159715051,Audio,Prairie Warbler,Setophaga discolor,,"Robert O'Connell",2019-05-18,2019,5,18,1000,United States,US-ME-031,Maine,York,Kennebunk Plains Webber Hill Road North Side,43.4021932,-70.6251683,Adult Male,Song,Not Used,"","",,,Zoom H4N Pro,Built In,None,,S56474299,"",,,,,Setophaga discolor,prawar,Species,32879,,4.00,3,"",,
159715041,Audio,Prairie Warbler,Setophaga discolor,,"Robert O'Connell",2019-05-18,2019,5,18,1000,United States,US-ME-031,Maine,York,Kennebunk Plains Webber Hill Road North Side,43.4021932,-70.6251683,Adult Male,Song,Not Used,"","",,,Zoom H4N Pro,Built In,None,,S56474299,"",,,,,Setophaga discolor,prawar,Species,32879,,4.50,2,"",,
159683691,Audio,Prairie Warbler,Setophaga discolor,,Matthew Wistrand,2019-05-19,2019,5,19,1259,United States,US-IL-043,Illinois,DuPage,FermiLab (DuPage Co.),41.8395126,-88.2190218,Adult Male,"Call; Song",Not Used,"","",,,Marantz PMD661 MKII,Sennheiser MKH20,Telinga Universal Pro parabola,,S56505080,"",,,"This is a poor recording (and I filtered out some of the wind noise in Audition), but it represents one of my favorite aspects of recording: hearing the bird ""sing to itself"". This recording includes a small number of full-powered songs, but mostly contains quiet (and very plastic) songs interspersed with chips and chatter.","Continuing male found earlier in the day by the monitors (h/t Glenn P for the heads-up). A beautiful yellow and olive warbler with black streaks at the breast sides/flanks, inconspicuous red streaking down the back, and a distinctive face pattern (yellow base, with black eye stripe and auricular border).",Setophaga discolor,prawar,Species,32879,,2.00,1,"",,
159678101,Audio,Prairie Warbler,Setophaga discolor,,Matthew Wistrand,2019-05-19,2019,5,19,1259,United States,US-IL-043,Illinois,DuPage,FermiLab (DuPage Co.),41.8395126,-88.2190218,Adult Male,Song,Not Used,"","",,,Marantz PMD661 MKII,Sennheiser MKH20,Telinga Universal Pro parabola,,S56505080,"",,,,"Continuing male found earlier in the day by the monitors (h/t Glenn P for the heads-up). A beautiful yellow and olive warbler with black streaks at the breast sides/flanks, inconspicuous red streaking down the back, and a distinctive face pattern (yellow base, with black eye stripe and auricular border).",Setophaga discolor,prawar,Species,32879,,4.00,2,"",,
159605231,Audio,Prairie Warbler,Setophaga discolor,"Catharus guttatus -- Hermit Thrush; Vireo plumbeus -- Plumbeous Vireo; Troglodytes aedon -- House Wren; Dryobates arizonae -- Arizona Woodpecker; Junco phaeonotus -- Yellow-eyed Junco; Piranga flava -- Hepatic Tanager",Rose Ann Rowlett,2019-05-16,2019,5,16,800,United States,US-AZ-003,Arizona,Cochise,Rucker Canyon--Cypress CG,31.7756392,-109.3129241,Adult Male – 1,"Foraging or Eating; Song",Not Used,"","",,,Fostex FR-2LE,Sennheiser ME62,Telinga Universal parabola,,S56496080,"",,,"Advertising song of adult male Prairie Warbler, a vagrant here in Rucker Canyon, 1600m. It was singing intermittently while foraging in blooming live oak trees at the edge of the riparian along Rucker Creek about .2 miles below Cypress Campground. Warm (75F) now (9:20AM, 16 May 2019) on a partly cloudy day (60% cloud cover) that started out clear and calm and 49F, but has increasingly become cloudy and breezy. Background of first cut includes Hermit Thrush singing; 2nd cut includes Piranga sp., Plumbeous Vireo, House Wren, Arizona Woodpecker call; 3rd cut includes presumed Yellow-eyed Junco, Plumbeous Vireo, same Piranga (proabably Hepatic), & House Wren. ","An intermittently given buzzy song, when I tracked it down, turned out to be a male Prairie Warbler singing as it foraged through blooming live oaks at the edge of the riparian of Arizona sycamores, pines, and Arizona cypress along the road .2 miles below the entrance to Cypress Campground in Rucker Canyon, 1600m, on 16 May 2019. I recorded its song (ML159605231), watching it from 9:15-10:00AM. I then hiked back to the campsite at the end of the road in Rucker Canyon to get Richard Webster, who drove us back down ca. 10:40A. We relocated it by its song--even less frequently given now as it was getting windier and later. I then watched it--and photographed it--while Richard went back to break camp and pick me up. I left the Prairie Warbler about 11:50A, continuing down the road birding for another 15 minutes. A rare spring vagrant in Arizona, and my first for Cochise County.",Setophaga discolor,prawar,Species,32879,,4.00,2,"",,
159502621,Audio,Prairie Warbler,Setophaga discolor,,William Hull,2019-05-18,2019,5,18,1346,United States,US-OH-001,Ohio,Adams,Shoemaker State Nature Preserve,38.9556900,-83.3425400,"",Song,Not Used,"","",,,Apple iPhone 7,,,,S56479744,"",,,,,Setophaga discolor,prawar,Species,32879,,4.00,2,"",,
159458101,Audio,Prairie Warbler,Setophaga discolor,,Craig Provost,2019-05-18,2019,5,18,1141,United States,US-VT-021,Vermont,Rutland,"park hill road, Benson",43.6917718,-73.3321467,Adult Male,Song,Not Used,"","",,,Samsung cell phone,,,,S56474669,"",,,,,Setophaga discolor,prawar,Species,32879,,2.50,2,"",,
159331201,Audio,Prairie Warbler,Setophaga discolor,,"Kat O'Reilly",2019-05-18,2019,5,18,725,United States,US-IL-031,Illinois,Cook,LaBagh Woods Forest Preserve,41.9803903,-87.7412754,"",Song,Not Used,"","",,,iPhone,,,,S56448596,"",,,"After golden wing, just before clip ends.","Singing. Excellent views, with another observer. Black mutton chop marks. Re-found by Jeff Skrenty about twenty minutes later. Kelly Ballantyne got photographs.",Setophaga discolor,prawar,Species,32879,,2.00,1,"",,
159321191,Audio,Prairie Warbler,Setophaga discolor,,Darrell Peterson,2019-05-18,2019,5,18,630,United States,US-VA-007,Virginia,Amelia,Amelia WMA,37.4628910,-77.9100446,Adult Male,Song,Not Used,"","",,,Sound Devices 702,Sennheiser MKH20,Telinga parabola,,S56453036,"",,,"From about 25 feet, singing from top of short bush",Large field scattered short bushes dove field area,Setophaga discolor,prawar,Species,32879,,5.00,2,"",,
159320771,Audio,Prairie Warbler,Setophaga discolor,,Darrell Peterson,2019-05-18,2019,5,18,630,United States,US-VA-007,Virginia,Amelia,Amelia WMA,37.4628910,-77.9100446,Adult Male,Song,Not Used,"","",,,Sound Devices 702,Sennheiser MKH20,Telinga parabola,,S56453036,"",,,,Large field scattered short bushes dove field area,Setophaga discolor,prawar,Species,32879,,4.50,2,"",,
159319981,Audio,Prairie Warbler,Setophaga discolor,,Anne Armstrong,2019-05-18,2019,5,18,908,United States,US-GA-159,Georgia,Jasper,Piedmont NWR--Pond 2A,33.1479624,-83.7534984,"",Song,Not Used,"","",,,"HTC 10, RecForge app",,,,S56451842,"",,,,,Setophaga discolor,prawar,Species,32879,,4.00,2,"",,
159316291,Audio,Prairie Warbler,Setophaga discolor,,Juliet Berger,2019-05-17,2019,5,17,1042,United States,US-MI-161,Michigan,Washtenaw,Pinckney RA--Hankerd Rd.,42.4058404,-83.9909935,Adult Male,Song,Not Used,"","",,,iPhone SE,,,,S56425841,"",,,"With EATO, NOCA and others.",Continuing since 2012 at least. Please do not play tapes for his bird. Singing loud and clear. Recording taken.,Setophaga discolor,prawar,Species,32879,,3.50,2,"",,
159126391,Audio,Prairie Warbler,Setophaga discolor,,aerin tedesco,2019-05-05,2019,5,5,1210,United States,US-IL-147,Illinois,Piatt,Upper Sangamon River Land and Water Reserve,40.0046948,-88.6148643,Adult Male,Song,Not Used,"","",,,iPhone 7,,,,S55886297,"",,,NOTE: there are some loud sounds on this recording so watch your ears!  sorry!,known location for this species... photos...,Setophaga discolor,prawar,Species,32879,,2.00,1,"",,
159122591,Audio,Prairie Warbler,Setophaga discolor,,Norka Saldana,2019-05-17,2019,5,17,738,United States,US-MI-161,Michigan,Washtenaw,Pinckney RA--Hankerd Rd.,42.4058404,-83.9909935,"",Song,Not Used,"","",,,iPhone8,,,,S56403741,"",,,,Continuing. Back in territory.,Setophaga discolor,prawar,Species,32879,,3.00,1,"",,
158948931,Audio,Prairie Warbler,Setophaga discolor,,Blaine Carnes,2019-05-15,2019,5,15,915,United States,US-VA-033,Virginia,Caroline,Fort AP Hill--APH2,38.1507920,-77.3384420,Adult Male,Song,Not Used,"","",,,Tascam DR-40,Audio-Technica AT875R,,,S56366386,"",,,,,Setophaga discolor,prawar,Species,32879,,3.00,1,"",,
158936331,Audio,Prairie Warbler,Setophaga discolor,,Matt Hysell,2019-05-16,2019,5,16,826,United States,US-MI-021,Michigan,Berrien,Warren Dunes SP--Floral Ln.,41.9213607,-86.5810794,"",Song,Not Used,"","",,,,,,,S56347989,"",,,,,Setophaga discolor,prawar,Species,32879,,3.00,1,"",,
158918401,Audio,Prairie Warbler,Setophaga discolor,,Rita Reed,2019-05-15,2019,5,15,1748,United States,US-NY-083,New York,Rensselaer,"348–406 Keefe Rd, Troy US-NY (42.8169,-73.4855)",42.8169120,-73.4855210,"",Song,Not Used,"","",,,,,,,S56323468,"",,,,,Setophaga discolor,prawar,Species,32879,,2.50,2,"",,
158793641,Audio,Prairie Warbler,Setophaga discolor,,Max Wilson,2019-05-14,2019,5,14,815,United States,US-MD-031,Maryland,Montgomery,Hughes Rd. polo fields,39.0948139,-77.4086809,Adult Male,Song,Not Used,"","",,,RODE Rec App on iPhone SE,native iPhone SE,,,S56263197,"",,,,,Setophaga discolor,prawar,Species,32879,,3.00,1,"",,
158756721,Audio,Prairie Warbler,Setophaga discolor,,Matt Brady,2018-04-19,2018,4,19,824,United States,US-LA-079,Louisiana,Rapides,Kisatchie NF--Messina Rd.,31.2206460,-92.6132890,Adult Male,Song,Not Used,"","",,,iPhone SE,internal,Røde app.,,S44752428,"",,,"A slightly odd alternate song at the beginning, but the bird switches to a more typical song towards the end.   250 Hz high pass filter to reduce wind noise.",,Setophaga discolor,prawar,Species,32879,,2.50,2,"",,
158625821,Audio,Prairie Warbler,Setophaga discolor,,G & B,2019-05-13,2019,5,13,730,United States,US-VT-021,Vermont,Rutland,BNC (Private properties within 5 mi.),43.4569605,-73.1618786,Adult Male,Song,Not Used,"","",,,Canon PowerShot SX40 HS,,,,S56219053,"",,,,FOY,Setophaga discolor,prawar,Species,33061,,3.00,2,"",,
158343901,Audio,Prairie Warbler,Setophaga discolor,,Paul Heveran,2019-05-11,2019,5,11,1615,United States,US-PA-091,Pennsylvania,Montgomery,Green Lane Park--Walt Rd.,40.3789888,-75.4999083,Adult Male,Song,Not Used,"","",,,Moto X Pure (phone),,,,S56141388,"",,,Yellow-rumped Warblers are also audible.,"One male sang a normal song, and I think the female was a breeder. A second male may have been a breeder. This male's song was interesting in that it was ascending but not buzzy, with several lower-pitched chip notes at the end.",Setophaga discolor,prawar,Species,32879,,2.50,2,"",,
158281341,Audio,Prairie Warbler,Setophaga discolor,,Will Sweet,2019-05-13,2019,5,13,837,United States,US-MA-021,Massachusetts,Norfolk,Moose Hill Farm (TTOR),42.1274396,-71.2149131,Adult Male,Song,Not Used,"","",,,iPhone7,,,,S56218481,"",,,,,Setophaga discolor,prawar,Species,32879,,3.00,1,"",,
158175101,Audio,Prairie Warbler,Setophaga discolor,,Sabrina Hepburn,2019-05-12,2019,5,12,659,United States,US-CO-059,Colorado,Jefferson,Chatfield SP--Audubon Center & Trails,39.4934273,-105.0918996,Male,Song,Not Used,"","",,,iPhone,,,,S56171416,"",,,House wren in foreground,Continuing from yesterday.  Photos and voice recording to add later.,Setophaga discolor,prawar,Species,32879,,3.50,2,"",,
157964391,Audio,Prairie Warbler,Setophaga discolor,,Matt Whitbeck,2019-05-11,2019,5,11,647,United States,US-MD-019,Maryland,Dorchester,Malkus clearcut,38.4879140,-76.1156320,"",Song,Not Used,"","",,,iPhone 6,internal mic,Voice Record app,,S56129382,"",,,,,Setophaga discolor,prawar,Species,32879,,3.50,2,"",,
157865161,Audio,Prairie Warbler,Setophaga discolor,,CLI Birding,2019-05-06,2019,5,6,1428,United States,US-NY-103,New York,Suffolk,West Meadow Wetlands Reserve,40.9327414,-73.1451702,Adult,Song,Not Used,"","",,,,,,,S55926922,"",,,,,Setophaga discolor,prawar,Species,32879,,5.00,2,"",,
157764021,Audio,Prairie Warbler,Setophaga discolor,,Colin Sumrall,2019-05-07,2019,5,7,1405,United States,US-FL-086,Florida,Miami-Dade,Black Point Park and Marina,25.5400214,-80.3274608,Adult Male,Song,Not Used,"","",,,Tascam DR-05,Audio-Technica ATR-6550,,,S55973105,"",,,,Photos and sound,Setophaga discolor,prawar,Species,32879,,3.50,2,"",,
157736571,Audio,Prairie Warbler,Setophaga discolor,,Austin Langdon,2019-05-11,2019,5,11,1030,United States,US-OH-165,Ohio,Warren,Miller Ecological Park,39.4546078,-84.2184999,"",Song,Unspecified,"","",,,iPhone 7,,,,S56128140,"",,,,"Heard singing just off the main trail with Peggy Logue, Amy Pond, and Rhadene Langdon.",Setophaga discolor,prawar,Species,32879,,2.00,1,"",,
157736531,Audio,Prairie Warbler,Setophaga discolor,,Austin Langdon,2019-05-11,2019,5,11,1030,United States,US-OH-165,Ohio,Warren,Miller Ecological Park,39.4546078,-84.2184999,"",Song,Unspecified,"","",,,iPhone 7,,,,S56128140,"",,,,"Heard singing just off the main trail with Peggy Logue, Amy Pond, and Rhadene Langdon.",Setophaga discolor,prawar,Species,32879,,1.00,1,"",,
157570401,Audio,Prairie Warbler,Setophaga discolor,,Dean Newhouse,2019-05-08,2019,5,8,1434,United States,US-PA-133,Pennsylvania,York,William H. Kain County Park--Lake Williams,39.8933902,-76.7164027,"",Song,Unspecified,"","",,,Canon Powershot SX60HS Camera,,,,S56015696,"",,,Prairie Warbler can be heard at 13 seconds.,,Setophaga discolor,prawar,Species,32879,,2.00,1,"",,
157570381,Audio,Prairie Warbler,Setophaga discolor,,Dean Newhouse,2019-05-08,2019,5,8,1434,United States,US-PA-133,Pennsylvania,York,William H. Kain County Park--Lake Williams,39.8933902,-76.7164027,"",Song,Unspecified,"","",,,Canon Powershot SX60HS Camera,,,,S56015696,"",,,Prairie Warbler can be heard at 10 seconds and again at 27 seconds.,,Setophaga discolor,prawar,Species,32879,,3.00,1,"",,
540877,Audio,Prairie Warbler,Setophaga discolor,Pipilo erythrophthalmus -- Eastern Towhee,Mark Robbins,2019-05-05,2019,5,5,1245,United States,US-MO-035,Missouri,Carter,highway J,36.8800000,-91.1920000,Adult Male – 1,Song,Not Used,"","",,,NAGRA ARES-BB+,Sennheiser ME 67,,,S55864312,"",,,"Open pine dominated woodland. Equipment Notes: NAGRA ARES-BB+; Sennheiser ME 67; with 100 Hz filter.",,Setophaga discolor,prawar,Species,32879,,2.00,4,"",,
157472571,Audio,Prairie Warbler,Setophaga discolor,,Bente Torvund,2019-05-09,2019,5,9,1047,United States,US-FL-021,Florida,Collier,Marco Island--Tiger Tail Beach,25.9480980,-81.7445600,Adult Male,Song,Not Used,"","",,,,,,,S56044546,"",,,,,Setophaga discolor,prawar,Species,32879,,2.00,1,"",,
157421761,Audio,Prairie Warbler,Setophaga discolor,,Wendy Sykora,2019-05-04,2019,5,4,835,United States,US-PA-029,Pennsylvania,Chester,Schuylkill River Trail--Cromby/Phoenixville,40.1480119,-75.5288621,Adult Male,Song,Not Used,"","",,,EZ Voice cell phone app,,Cell phone,,S55762152,"",,,One song at 10 seconds.,Picture to follow. Distinctly saw black cheek and eye markings.  Also have a so-so recording to follow.,Setophaga discolor,prawar,Species,32879,,2.50,2,"",,
157334291,Audio,Prairie Warbler,Setophaga discolor,,Bente Torvund,2019-05-09,2019,5,9,827,United States,US-FL-021,Florida,Collier,Marco Island--Tiger Tail Beach,25.9480980,-81.7445600,Adult Male,Song,Not Used,"","",,,,,,,S56040082,"",,,,7 singing,Setophaga discolor,prawar,Species,32879,,2.00,1,"",,
157286351,Audio,Prairie Warbler,Setophaga discolor,,Karen & Tom Beatty,2019-05-09,2019,5,9,602,United States,US-VA-810,Virginia,Virginia Beach,**Back Bay NWR,36.6721270,-75.9156610,Male,Song,Not Used,"","",,,Tascam,,windshield,,S56037301,"",,,,,Setophaga discolor,prawar,Species,33061,,3.00,2,"",,
157275411,Audio,Prairie Warbler,Setophaga discolor,,Jeffrey Offermann,2019-05-08,2019,5,8,707,United States,US-MA-017,Massachusetts,Middlesex,Mt. Auburn Cemetery,42.3710000,-71.1460000,Adult Male,Song,Not Used,"","",,,iPhone 7 Plus,native iPhone microphone,none,,S56002120,"",,,A Northern Parula is also captured in this recording.,,Setophaga discolor,prawar,Species,32879,,3.50,2,"",,
157261611,Audio,Prairie Warbler,Setophaga discolor,"Myiarchus crinitus -- Great Crested Flycatcher; Vireo griseus -- White-eyed Vireo; Icteria virens -- Yellow-breasted Chat; Vireo olivaceus -- Red-eyed Vireo; Baeolophus bicolor -- Tufted Titmouse; Cardinalis cardinalis -- Northern Cardinal",Blaine Carnes,2019-05-08,2019,5,8,530,United States,US-AL-007,Alabama,Bibb,Talladega NF--Oakmulgee District,32.9932945,-87.3045053,Adult Male – 1,Song,Not Used,"","",,,Tascam DR-40,Audio-Technica AT875R,,,S56034976,"",,,,,Setophaga discolor,prawar,Species,32879,,3.00,1,"",,
157163991,Audio,Prairie Warbler,Setophaga discolor,,Burke Korol,2019-05-08,2019,5,8,946,Canada,CA-ON-SC,Ontario,Simcoe,Tiny Marsh,44.6083333,-79.9397222,Adult Male,Song,Not Used,"","",,,iPhone - RODE software,,,,S56004179,"",,,,,Setophaga discolor,prawar,Species,32879,,3.00,1,"",,
157002231,Audio,Prairie Warbler,Setophaga discolor,,Owen Strickland,2019-05-07,2019,5,7,1300,Canada,CA-ON-TO,Ontario,Toronto,Tommy Thompson Park,43.6282673,-79.3291670,"",Song,Unspecified,"","",,,,,,,S55990119,"",,,,"Nice find, Gavin!",Setophaga discolor,prawar,Species,33061,,4.00,2,"",,
156927151,Audio,Prairie Warbler,Setophaga discolor,,Ryan Griffiths,2019-05-07,2019,5,7,1131,Canada,CA-ON-NG,Ontario,Niagara,NOTL - Seaway Haulage Road @ Homer Rd,43.1571540,-79.1825937,"",Song,Not Used,"","",,,,,,,S55972660,"",,,,"Sounded off once while recording vireo call. Similar in tone to black-throated blue but consistently ascending. Searched for some time but unfortunately could not locate the bird. End of the trail off homer road, where the field and shrubland begin.",Setophaga discolor,prawar,Species,32879,,3.00,1,"",,
156872371,Audio,Prairie Warbler,Setophaga discolor,,Chris Martone,2019-05-07,2019,5,7,1013,United States,US-MA-009,Massachusetts,Essex,Lynnfield Marsh--IBA,42.5280000,-71.0510000,"",Song,Not Used,"","",,,,,,,S55966007,"",,,,"FOY here. Point blank look, start of Partridge boardwalk. Audio recording.",Setophaga discolor,prawar,Species,32879,,3.00,1,"",,
156653831,Audio,Prairie Warbler,Setophaga discolor,,valerie heemstra,2019-05-04,2019,5,4,515,United States,US-NY-119,New York,Westchester,Rockefeller SP Preserve--Swan Lake area,41.1098093,-73.8352114,Adult,Song,Not Used,"","",,,Sound Devices MIXPRE3,Telinga ProUniversal parabolic ME62 Sennheiser Omni mic,22 inch parabola,,S55813244,"",,,This is one of the most distinctive warbler songs with its slow rising pitch.,In the top of tall deciduous trees near a Baltimore Oriole and a Scarlet Tanager (both birds can be heard on recording),Setophaga discolor,prawar,Species,32879,,3.00,1,"",,
156571221,Audio,Prairie Warbler,Setophaga discolor,,Kriss Replogle,2019-05-06,2019,5,6,1242,United States,US-NY-087,New York,Rockland,Tallman Mountain SP,41.0262764,-73.9088058,Adult Male,Song,Not Used,"","",,,IPhone6s,,,,S55916528,"",,,,,Setophaga discolor,prawar,Species,33061,,1.00,1,"",,
156548141,Audio,Prairie Warbler,Setophaga discolor,,Matthew Schenck,2019-05-06,2019,5,6,705,United States,US-RI-003,Rhode Island,Kent,Nicholas Farm Management Area,41.6829653,-71.7741332,Adult Male,Song,Not Used,"","",,,,,,,S55900448,"",,,,All singing from around the clearcut,Setophaga discolor,prawar,Species,32879,,3.50,2,"",,
156502871,Audio,Prairie Warbler,Setophaga discolor,,Christine Stoughton Root,2019-05-05,2019,5,5,825,United States,US-NC-125,North Carolina,Moore,Weymouth Woods Sandhills Nature Preserve,35.1471875,-79.3689895,Adult Male,Song,Not Used,"","",,,Zoom H4n Pro,Sennheiser MKE 600 Shotgun Microphone,,,S55881430,"",,,,,Setophaga discolor,prawar,Species,32879,,3.00,1,"",,
156478731,Audio,Prairie Warbler,Setophaga discolor,,Tom Wheatley,2019-05-06,2019,5,6,721,Canada,CA-ON-LA,Ontario,Lennox and Addington,BBA_18TUQ34 (extreme NW corner),44.6734347,-77.1429107,Adult Male,Song,Not Used,"","",,,,,,,S55898796,"",,,,"Heard, seen.  Yellow warbler with blach marking around eye,    at known site. Voice recordings attached.",Setophaga discolor,prawar,Species,32879,,3.00,1,"",,
156189491,Audio,Prairie Warbler,Setophaga discolor,,Gordon Karre,2019-04-29,2019,4,29,1606,United States,US-FL-086,Florida,Miami-Dade,Black Point Park and Marina,25.5400214,-80.3274608,Adult Male,Song,Not Used,"","",,,,,,,S55566760,"",,,,,Setophaga discolor,prawar,Species,32879,,2.00,1,"",,
156047561,Audio,Prairie Warbler,Setophaga discolor,,Celeste Morien,2019-05-03,2019,5,3,1340,United States,US-NY-073,New York,Orleans,Lakeside Beach SP,43.3668991,-78.2358989,Adult Male,Song,Not Used,"","",,,iPhone 8,None,None,,S55726048,"",,,Background sounds but rising song still audible.,"Seen well. Yellow underparts and face. Yellow-olive above, yellow wing bar, black streaks on flanks and distinctive facial pattern with black crescent below black eyeline.  Recorded song.",Setophaga discolor,prawar,Species,32879,,2.00,1,"",,
156044041,Audio,Prairie Warbler,Setophaga discolor,,Celeste Morien,2019-05-03,2019,5,3,1340,United States,US-NY-073,New York,Orleans,Lakeside Beach SP,43.3668991,-78.2358989,Adult Male,Song,Not Used,"","",,,iPhone,None,None,,S55726048,"",,,Background sounds but rising song still audible.,"Seen well. Yellow underparts and face. Yellow-olive above, yellow wing bar, black streaks on flanks and distinctive facial pattern with black crescent below black eyeline.  Recorded song.",Setophaga discolor,prawar,Species,32879,,3.00,1,"",,
155997291,Audio,Prairie Warbler,Setophaga discolor,,Kerry Loux,2019-05-04,2019,5,4,847,United States,US-NJ-021,New Jersey,Mercer,"80 River Drive, Hopewell Township, New Jersey, US (40.305, -74.877)",40.3047805,-74.8772674,"",Song,Not Used,"","",,,LG Pixel 2 XL,Built-in mic,,,S55768498,"",,,"Very poor quality, but can make out song once near the beginning of recording and once near the end.",,Setophaga discolor,prawar,Species,32879,,1.00,1,"",,
155635541,Audio,Prairie Warbler,Setophaga discolor,,Guy Babineau,2019-05-03,2019,5,3,806,United States,US-VA-109,Virginia,Louisa,Keswick SE,38.0209786,-78.2809863,Adult Male,Song,Not Used,"","",,,,,,,S55715231,"",,,,,Setophaga discolor,prawar,Species,32879,,3.00,2,"",,
155619091,Audio,Prairie Warbler,Setophaga discolor,,Joseph Salmieri Jr.,2019-05-02,2019,5,2,716,United States,US-NJ-007,New Jersey,Camden,Hill Forest,39.8292890,-74.9917491,Adult Male,Song,Not Used,"","",,,Samsung Galaxy S4,,,,S55664166,"",,,,,Setophaga discolor,prawar,Species,32879,,1.00,1,"",,
155436141,Audio,Prairie Warbler,Setophaga discolor,,Jay Sturner,2019-04-25,2019,4,25,1456,United States,US-TN-009,Tennessee,Blount,"Foothills Parkway between 20 and 21 (35.716, -83.772)",35.7162847,-83.7721378,Adult Male,Song,Not Used,"","",,,,,,,S55410729,"",,,,Chased off another male.,Setophaga discolor,prawar,Species,32879,,4.33,3,"",,
155339831,Audio,Prairie Warbler,Setophaga discolor,,John Carter,2019-05-02,2019,5,2,708,United States,US-PA-027,Pennsylvania,Centre,Bald Eagle SP--Lower Greens Run,41.0102485,-77.6741230,"",Song,Not Used,"","",,,RecForge II,,,,S55664730,"",,,,,Setophaga discolor,prawar,Species,32879,,3.00,1,"",,
155337841,Audio,Prairie Warbler,Setophaga discolor,,Adam Hartz,2019-05-01,2019,5,1,1448,United States,US-MO-099,Missouri,Jefferson,"1001 Paula Drive, Arnold, Missouri, US (38.429, -90.418)",38.4294998,-90.4175133,"",Song,Not Used,"","",,,,,,,S55642112,"",,,"the recording isn't great, as the bird was far away.  However, based on the range of the tone, phrasing, I ruled out Parula's alternate song and settled on prairie warbler.  No visual of the bird.",,Setophaga discolor,prawar,Species,32879,,2.00,1,"",,
155139141,Audio,Prairie Warbler,Setophaga discolor,,LynnErla Beegle,2019-04-28,2019,4,28,745,United States,US-NC-019,North Carolina,Brunswick,Boiling Spring Lakes Nature Trail,34.0208928,-78.0637729,Adult Male,Song,Not Used,"","",,,and ML154738531,,,,S55504426,"",,,Same PRAW as ML154738641. Recorded at 9:25 EDT,,Setophaga discolor,prawar,Species,32879,,3.50,2,"",,
155064841,Audio,Prairie Warbler,Setophaga discolor,,Gabriel Gonzalez,2019-04-27,2019,4,27,724,United States,US-FL-103,Florida,Pinellas,Fort De Soto Park,27.6327266,-82.7181570,Adult Male,Song,Not Used,"","",,,,,,,S55490551,"",,,,,Setophaga discolor,prawar,Species,32879,,3.00,1,"",,
154995231,Audio,Prairie Warbler,Setophaga discolor,,Megan Kasprzak,2019-04-30,2019,4,30,740,United States,US-DE-003,Delaware,New Castle,Ashland Nature Center and Hawk Watch,39.7970734,-75.6596680,"",Song,Not Used,"","",,,,,,,S55589701,"",,,,,Setophaga discolor,prawar,Species,32879,,1.00,1,"",,
154911611,Audio,Prairie Warbler,Setophaga discolor,,Marilyn Westphal,2019-04-30,2019,4,30,725,United States,US-NC-089,North Carolina,Henderson,Pisgah NF - Wash Crk Rd,35.4416199,-82.6622486,Adult Male,Song,Not Used,"","",,,Marantz PMD661 MKII,Sennheiser ME66,headphones,,S55592438,"",,,Prairie singing a few times amid several other species also singing,,Setophaga discolor,prawar,Species,32879,,2.00,1,"",,
154780111,Audio,Prairie Warbler,Setophaga discolor,,robert bowker,2019-04-29,2019,4,29,1606,United States,US-FL-086,Florida,Miami-Dade,Black Point Park and Marina,25.5400214,-80.3274608,Adult Male,Song,Not Used,"","",,,iphone,,,,S55573165,"",,,,,Setophaga discolor,prawar,Species,32879,,4.00,2,"",,
154549291,Audio,Prairie Warbler,Setophaga discolor,,Chas Argent,2019-04-28,2019,4,28,810,United States,US-MD-003,Maryland,Anne Arundel,Patuxent Research Refuge--North Tract,39.0778753,-76.7713881,Adult Male,Song,Not Used,"","",,,Olympus WS-853,Internal,none,,S55514184,"",,,,,Setophaga discolor,prawar,Species,32879,,3.00,1,"",,
154433921,Audio,Prairie Warbler,Setophaga discolor,,Mark R Johnson,2019-04-28,2019,4,28,1055,United States,US-MD-025,Maryland,Harford,Perryman Park,39.4731729,-76.2158489,"",Song,Unspecified,"","",,,,,,,S55515967,"",,,,,Setophaga discolor,prawar,Species,32879,,3.00,1,"",,
154286531,Audio,Prairie Warbler,Setophaga discolor,,Colin Sumrall,2019-04-26,2019,4,26,1119,United States,US-KY-147,Kentucky,McCreary,Cumberland Falls SRP (McCreary Co.)--Trail 9 & Eagle Falls Trail,36.8388969,-84.3455794,Adult,Song,Not Used,"","",,,Tascam DR-05,Audio-Technica ATR-6550,,,S55430755,"",,,,,Setophaga discolor,prawar,Species,32879,,3.50,2,"",,
