ML Catalog Number,Format,Common Name,Scientific Name,Background Species,Recordist,Date,Year,Month,Day,Time,Country,Country-State-County,State,County,Locality,Latitude,Longitude,Age/Sex,Behaviors,Playback,Captive,Collected,Specimen ID,Home Archive Catalog Number,Recorder,Microphone,Accessory,Partner Institution,eBird Checklist ID,Unconfirmed,Air Temp(°C),Water Temp(°C),Media notes,Observation Details,Parent Species,eBird Species Code,Taxon Category,Taxonomic Sort,Recordist 2,Average Community Rating,Number of Ratings,Asset Tags,Original Image Height,Original Image Width
403435341,Audio,Prairie Warbler,Setophaga discolor,"Colaptes auratus -- Northern Flicker; Geothlypis trichas -- Common Yellowthroat",Dave C.,2021-05-07,2021,5,7,1055,United States,US-RI-005,Rhode Island,Newport,Norman Bird Sanctuary,41.4994349,-71.2529254,Adult Male – 1,Song,Not Used,"","",,,iPhone XR,iPhone XR,None,,S87347449,"",,,Norman Bird Sanctuary ,,Setophaga discolor,prawar,Species,33061,,2.00,1,"",,
401912351,Audio,Prairie Warbler,Setophaga discolor,"Vireo griseus -- White-eyed Vireo; Corvus brachyrhynchos -- American Crow; Passerina cyanea -- Indigo Bunting; Empidonax virescens -- Acadian Flycatcher; Cardinalis cardinalis -- Northern Cardinal",Michael S Taylor,2021-06-24,2021,6,24,624,United States,US-MO-017,Missouri,Bollinger,3Cat Acres,37.3587300,-90.0236900,Adult Male – 1,Song,Not Used,"","",,,Sound Devices MixPre-3,Sennheiser ME62 Shotgun,"Telinga 22"" Parabola",,S90684813,"",,,,,Setophaga discolor,prawar,Species,33061,,4.00,1,"",,
394638441,Audio,Prairie Warbler,Setophaga discolor,,Nick Varvel,2018-06-02,2018,6,2,1027,United States,US-KS-167,Kansas,Russell,"stakeout Prairie Warbler, Dorrance (2018)",38.9218190,-98.6569590,Adult Male – 1,Song,Not Used,"","",,,iPhone 7,iPhone 7,,,S98675498,"",,,,,Setophaga discolor,prawar,Species,33061,,3.00,1,"",,
393460951,Audio,Prairie Warbler,Setophaga discolor,"Cyanocitta cristata -- Blue Jay; Setophaga virens -- Black-throated Green Warbler; Setophaga caerulescens -- Black-throated Blue Warbler",Amy Swarr,2021-05-08,2021,5,8,1359,United States,US-VT-027,Vermont,Windsor,Powerlines Trail,43.4467750,-72.4026897,Adult Male – 1,Song,Unspecified,"","",,,Samsung-SM-G930V,,,,S87494189,"",,,Male singing.,First of season,Setophaga discolor,prawar,Species,33061,,4.00,1,"",,
391424721,Audio,Prairie Warbler,Setophaga discolor,"Dumetella carolinensis -- Gray Catbird; Agelaius phoeniceus -- Red-winged Blackbird; Cardinalis cardinalis -- Northern Cardinal; Cistothorus palustris -- Marsh Wren; Melanerpes carolinus -- Red-bellied Woodpecker; Quiscalus quiscula -- Common Grackle",Marian Jordan,2017-05-29,2017,5,29,1219,United States,US-NJ-011,New Jersey,Cumberland,Bivalve--High St,39.2337656,-75.0365728,Adult – 1,Song,Not Used,"","",,,iPhone 5,none,none,,S37345573,"",,,"Call at 5, 27, 48 and 106 seconds.",,Setophaga discolor,prawar,Species,33061,,2.00,1,"",,
389480741,Audio,Prairie Warbler,Setophaga discolor,Dryocopus pileatus -- Pileated Woodpecker,Daniel S.,2015-04-30,2015,4,30,704,United States,US-DC-001,District of Columbia,District of Columbia,Rock Creek Park--Nature Center area,38.9594020,-77.0514120,"",Song,Not Used,"","",,,iPhone,,,,S23143917,"",,,,,Setophaga discolor,prawar,Species,33061,,2.00,1,"",,
354608991,Audio,Prairie Warbler,Setophaga discolor,"Passerina cyanea -- Indigo Bunting; Corvus brachyrhynchos -- American Crow; Setophaga americana -- Northern Parula; Baeolophus bicolor -- Tufted Titmouse; Spinus tristis -- American Goldfinch",Michael S Taylor,2021-07-09,2021,7,9,738,United States,US-MO-017,Missouri,Bollinger,3Cat Acres,37.3587300,-90.0236900,Adult Male – 1,Song,Not Used,"","",,,Sound Devices MixPre-3,Sennheiser ME62 Shotgun,"Telinga 22"" Parabola",,S91477929,"",,,,,Setophaga discolor,prawar,Species,32879,,3.00,1,"",,
353246691,Audio,Prairie Warbler,Setophaga discolor,"Vireo griseus -- White-eyed Vireo; Pipilo erythrophthalmus -- Eastern Towhee; Spizella pusilla -- Field Sparrow; Icteria virens -- Yellow-breasted Chat",Martin Wall,2021-07-03,2021,7,3,535,United States,US-NC-157,North Carolina,Rockingham,"27288, Eden US-NC (36.4426,-79.7958)",36.4425760,-79.7957510,"","Call; Song",Not Used,"","",,,iPhone SE,,,,S91168080,"",,,several birds,,Setophaga discolor,prawar,Species,32879,,2.00,1,"",,
353245901,Audio,Prairie Warbler,Setophaga discolor,"Icteria virens -- Yellow-breasted Chat; Vireo griseus -- White-eyed Vireo",Martin Wall,2021-06-28,2021,6,28,711,United States,US-NC-157,North Carolina,Rockingham,"Buffalo Rd, Eden US-NC (36.5409,-79.6354)",36.5409490,-79.6353900,Adult Male – 1,Song,Not Used,"","",,,iPhone SE,,,,S90918387,"",,,,Immature following adult with male singing nearby...finally saw it being fed,Setophaga discolor,prawar,Species,32879,,2.00,1,"",,
352910841,Audio,Prairie Warbler,Setophaga discolor,Cardinalis cardinalis -- Northern Cardinal,Carole Swann,2021-07-07,2021,7,7,710,United States,US-TN-149,Tennessee,Rutherford,Flat Rock Cedar Glades SNA,35.8545148,-86.3045248,Unknown – 1,Song,Not Used,"","",,,iPhone Xr,Built-in microphone,,,S91389531,"",,,"Prairie Warbler's zee, zee, song rising up the scale.  Northern Cardinal's ""cheer, cheer"".  In the background.  ",Heard at 4 different locations on walk.,Setophaga discolor,prawar,Species,33061,,3.00,1,"",,
351515441,Audio,Prairie Warbler,Setophaga discolor,"Vireo gilvus -- Warbling Vireo; Spizella pusilla -- Field Sparrow; Melospiza melodia -- Song Sparrow; Dolichonyx oryzivorus -- Bobolink; Cardinalis cardinalis -- Northern Cardinal; Troglodytes aedon -- House Wren",Beejo C,2021-06-15,2021,6,15,806,United States,US-VT-021,Vermont,Rutland,BNC (Private properties within 5 mi.),43.4569605,-73.1618786,"",Song,Not Used,"","",,,Canon Powershot SX40 HS,,,,S90224028,"",,,,,Setophaga discolor,prawar,Species,33061,,2.00,3,"",,
350825671,Audio,Prairie Warbler,Setophaga discolor,"Setophaga americana -- Northern Parula; Passerina cyanea -- Indigo Bunting; Polioptila caerulea -- Blue-gray Gnatcatcher; Geothlypis trichas -- Common Yellowthroat",Teresa Noel,2021-06-27,2021,6,27,1551,United States,US-KY-187,Kentucky,Owen,"Cedar Road, Owenton, Kentucky, US (38.364, -84.745)",38.3640313,-84.7452323,"",Song,Not Used,"","",,,Adroid phone RecForge II app,,,,S90895760,"",,,,"There recording also includes a Blue-gray Gnatcatcher, Northern Parula, Common Yellowthroat and Indigo Bunting.",Setophaga discolor,prawar,Species,32879,,3.00,1,"",,
350775831,Audio,Prairie Warbler,Setophaga discolor,,Jerred Seveyka,2021-05-04,2021,5,4,1201,United States,US-AR-057,Arkansas,Hempstead,Rick Evans Grandview Prairie WMA,33.8078217,-93.7767220,"",Song,Not Used,"","",,,Tascam DR05,Wildtronics Pro Mono Amplified,Parabola,,S87297214,"",,,,,Setophaga discolor,prawar,Species,32879,,4.00,1,"",,
350616401,Audio,Prairie Warbler,Setophaga discolor,,Julia Plummer,2021-06-27,2021,6,27,708,United States,US-PA-027,Pennsylvania,Centre,Rusnak Hill--reclaimed stripmine,41.0617371,-77.9071884,Adult Male – 1,Song,Not Used,"","",,,Zoom F1,Sennheiser ME-62,Telinga Parabola,,S90858660,"",,,,,Setophaga discolor,prawar,Species,32879,,3.00,1,"",,
350616281,Audio,Prairie Warbler,Setophaga discolor,,Julia Plummer,2021-06-27,2021,6,27,708,United States,US-PA-027,Pennsylvania,Centre,Rusnak Hill--reclaimed stripmine,41.0617371,-77.9071884,Adult Male – 1,Song,Not Used,"","",,,Zoom F1,Sennheiser ME-62,Telinga Parabola,,S90858660,"",,,,,Setophaga discolor,prawar,Species,32879,,3.00,1,"",,
350516801,Audio,Prairie Warbler,Setophaga discolor,"Baeolophus bicolor -- Tufted Titmouse; Thryothorus ludovicianus -- Carolina Wren; Cardinalis cardinalis -- Northern Cardinal",Luis Mendes,2021-06-26,2021,6,26,351,United States,US-RI-001,Rhode Island,Bristol,"Mount Hope Bay, from the Clipper Way public access trail",41.6822544,-71.2382505,"",Song,Not Used,"","",,,Canon Power Shot S2 IS camera,,,,S90838103,"",,,,,Setophaga discolor,prawar,Species,32879,,3.00,1,"",,
350439711,Audio,Prairie Warbler,Setophaga discolor,,Patty & Kevin McKelvey,2021-06-26,2021,6,26,1200,United States,US-OH-093,Ohio,Lorain,"Krebs Rd & Del Lane Utility ROW South of RR Tracks, Avon Lake",41.4787460,-81.9792610,Adult Male – 1,Song,Unspecified,"","",,,iPhone 11,,,,S90821008,"",,,"","Terrific find shared by Spencer Ryan!! Heard repeatedly singing classic ascending song and then got visual of it eating a caterpillar. Handsome adult male - yellow, red streaks on upper back, yellow eyebrows, black arc under eyes, several black stripes on flanks. Audio with other bird songs interspersed.",Setophaga discolor,prawar,Species,33061,,5.00,1,"",,
350377941,Audio,Prairie Warbler,Setophaga discolor,,Seth Buddy,2021-06-26,2021,6,26,528,United States,US-MA-007,Massachusetts,Dukes,"1–9 North Rd, Chilmark US-MA 41.39812, -70.70430",41.3981180,-70.7042970,Adult Male – 1,"Foraging or Eating; Song",Not Used,"","",,,Tascam DR-100MKIII,Wildtronics Pro Mono,"Wildtronics 22"" parabola; windscreen",,S90796664,"",,,"PRWA was mainly singing from a half-bare Amelanchier (Shadbush), but also foraging, preening, and making the rounds of his territory.  I also saw a female (his mate?) foraging low around him.",,Setophaga discolor,prawar,Species,32879,,5.00,2,"",,
350279961,Audio,Prairie Warbler,Setophaga discolor,,Sean Smith,2021-06-25,2021,6,25,1530,United States,US-ME-017,Maine,Oxford,"Main  Street (Rt. 117), Hiram Village",43.8806651,-70.8004395,Adult Male – 1,Song,Not Used,"","",,,,,,,S90776376,"",,,Singing infrequently in the afternoon heat.  One repetition was recorded of 3 that were heard. (not a great recording but discernable sonogram).,"Sporadically singing bird (or 2) at edges of sand pit... [AUDIO] of 1 of the three song repetitions given while we were there.  Not unusual.  The species was photographed, recorded and confirmed in 2020.  Likely a small breeding population exclusive to the area around the sand pits.",Setophaga discolor,prawar,Species,32879,,1.00,1,"",,
349804411,Audio,Prairie Warbler,Setophaga discolor,"Chaetura pelagica -- Chimney Swift; Turdus migratorius -- American Robin",Sheryl Johnson,2021-06-23,2021,6,23,816,United States,US-MA-001,Massachusetts,Barnstable,Long Beach Conservation Area,41.6349968,-70.3534057,"",Song,Not Used,"","",,,LG,,,,S90639675,"",,,,"never had one here in 30+ years; singing from trees at end of paved road/entrance to area",Setophaga discolor,prawar,Species,32879,,3.00,1,"",,
349781761,Audio,Prairie Warbler,Setophaga discolor,"Passerina cyanea -- Indigo Bunting; Pipilo erythrophthalmus -- Eastern Towhee; Icteria virens -- Yellow-breasted Chat; Cardinalis cardinalis -- Northern Cardinal",Martin Wall,2021-06-22,2021,6,22,725,United States,US-NC-157,North Carolina,Rockingham,"27288, Eden US-NC (36.4426,-79.7958)",36.4425760,-79.7957510,Adult Male – 1,Song,Not Used,"","",,,iPhone SE,,,,S90589587,"",,,,,Setophaga discolor,prawar,Species,32879,,3.00,1,"",,
349781461,Audio,Prairie Warbler,Setophaga discolor,"Vireo griseus -- White-eyed Vireo; Spizella pusilla -- Field Sparrow; Passerina cyanea -- Indigo Bunting",Martin Wall,2021-06-22,2021,6,22,618,United States,US-NC-157,North Carolina,Rockingham,"27288, Eden US-NC (36.4426,-79.7958)",36.4425760,-79.7957510,Male – 1,Song,Not Used,"","",,,iPhone SE,,,,S90589507,"",,,young bird possibly influenced by Field Sparrows,,Setophaga discolor,prawar,Species,32879,,3.00,1,"",,
349678691,Audio,Prairie Warbler,Setophaga discolor,"Cardinalis cardinalis -- Northern Cardinal; Poecile carolinensis -- Carolina Chickadee; Spizella pusilla -- Field Sparrow",Carole Swann,2021-06-22,2021,6,22,1144,United States,US-TN-149,Tennessee,Rutherford,Stones River National Battlefield,35.8720815,-86.4342499,Unknown – 1,Song,Not Used,"","",,,iPhone Xr,Built-in microphone,,,S90619198,"",,,"A plane, Northern Cardinal, Carolina Chickadee, Field Sparrow in the background.",,Setophaga discolor,prawar,Species,32879,,5.00,1,"",,
349670101,Audio,Prairie Warbler,Setophaga discolor,"Mniotilta varia -- Black-and-white Warbler; Vireo olivaceus -- Red-eyed Vireo",Fyn Kynd,2021-06-22,2021,6,22,722,United States,US-ME-029,Maine,Washington,"Columbia Falls--Montegail Road | 44.73, -67.751",44.7295235,-67.7508144,"",Song,Not Used,"","",,,Samsung Galaxy S9+,,,,S90617597,"",,,,"*uncommon in Washington County | My second this week - 9th county record. Singing their rising buzzy tune at the edge of a recently selectively cut area with only ~8m tall spruces remaining. The younger conifer growth that it's utilizing is a bit atypical to what they usually call home in Maine. Really fun to see these birds at the far eastern fringe of their breeding range. There's a decent amount of suitable habitat around the blueberry barrens here.",Setophaga discolor,prawar,Species,32879,,2.50,2,"",,
349215071,Audio,Prairie Warbler,Setophaga discolor,,Luis Mendes,2021-06-20,2021,6,20,847,United States,US-RI-001,Rhode Island,Bristol,"Mount Hope Bay, from the Clipper Way public access trail",41.6822544,-71.2382505,"",Song,Unspecified,"","",,,Canon Power Shot S3 IS camera,,,,S90517762,"",,,,,Setophaga discolor,prawar,Species,32879,,2.00,1,"",,
349177171,Audio,Prairie Warbler,Setophaga discolor,"Bombycilla cedrorum -- Cedar Waxwing; Setophaga pensylvanica -- Chestnut-sided Warbler",Fyn Kynd,2021-06-20,2021,6,20,1044,United States,US-ME-029,Maine,Washington,"Deblois--44.771, -67.997",44.7711808,-67.9966281,Adult Male – 1,Song,Not Used,"","",,,Samsung Galaxy S9+,,,,S90490335,"",,,That damn Chipmunk.,"*uncommon this far east in the state | Singing and foraging around a patch of scrub along a blueberry barren; maples and birches under 5 meters with sweet fern and blueberry understory. A flavus warbler with a light green back and black flank streaking. Photos and audio.  Seemingly only defending territory and feeding himself at this point. Lots of singing and moving between perches in a general 130 meter area. Come on man, give us that confirmed breeding evidence!",Setophaga discolor,prawar,Species,32879,,3.00,1,"",,
349165391,Audio,Prairie Warbler,Setophaga discolor,"Melospiza melodia -- Song Sparrow; Seiurus aurocapilla -- Ovenbird; Geothlypis trichas -- Common Yellowthroat; Buteo lineatus [lineatus Group] -- Red-shouldered Hawk (lineatus Group); Dumetella carolinensis -- Gray Catbird",Christopher McPherson,2021-06-20,2021,6,20,1029,United States,US-NH-011,New Hampshire,Hillsborough,"Lancy Brook wetlands, Brookline",42.7466592,-71.7079653,Adult Male – 1,"Foraging or Eating; Song",Not Used,"","",,,Sound Devices Mixpre 3 II,Sennheiser MKH20,Telinga Univ. MK II,,S90492035,"",,,,,Setophaga discolor,prawar,Species,32879,,2.00,1,"",,
348815011,Audio,Prairie Warbler,Setophaga discolor,,Brian Sullivan,2021-06-18,2021,6,18,822,United States,US-MS-089,Mississippi,Madison,"Pipeline Rd, Canton US-MS 32.54837, -89.93465",32.5483750,-89.9346490,Adult Male – 1,Song,Not Used,"","",,,Marantz PMD661 MKII,Sennheiser MKH70,,,S90368697,"",,,,,Setophaga discolor,prawar,Species,32879,,3.00,1,"",,
348543521,Audio,Prairie Warbler,Setophaga discolor,"Cyanocitta cristata -- Blue Jay; Turdus migratorius -- American Robin; Dolichonyx oryzivorus -- Bobolink",Matthew Danihel,2021-05-26,2021,5,26,1500,United States,US-PA-017,Pennsylvania,Bucks,Van Sant Airport,40.4812992,-75.1057461,Adult Male – 1,Song,Not Used,"","",,,Samsung Galaxy S7,,,,S89048863,"",,,Recording also features Brood X cicadas.,,Setophaga discolor,prawar,Species,32879,,2.00,1,"",,
348311121,Audio,Prairie Warbler,Setophaga discolor,Poecile atricapillus -- Black-capped Chickadee,Chris Chappell,2021-06-16,2021,6,16,651,United States,US-NY-027,New York,Dutchess,Roger Perry Memorial Preserve,41.7315289,-73.5626101,"",Song,Not Used,"","",,,,,,,S90297670,"",,,,,Setophaga discolor,prawar,Species,33061,,5.00,1,"",,
348057841,Audio,Prairie Warbler,Setophaga discolor,Cardinalis cardinalis -- Northern Cardinal,Daniel Young,2021-04-21,2021,4,21,902,United States,US-FL-127,Florida,Volusia,Doris Leeper Spruce Creek Preserve,29.0679110,-81.0009956,Adult Male – 1,"Foraging or Eating; Song",Not Used,"","",,,iPhone 12 mini,iPhone only no accessories,iPhone only no accessories,,S86023395,"",,,"I think that's a NOCA in the background",,Setophaga discolor,prawar,Species,32879,,4.00,1,"",,
347868001,Audio,Prairie Warbler,Setophaga discolor,,Jerred Seveyka,2021-04-22,2021,4,22,607,United States,US-AL-097,Alabama,Mobile,Dauphin Island--Audubon Bird Sanctuary,30.2487987,-88.0864692,"",Song,Not Used,"","",,,Tascam DR05,Wildtronics Omni Amplified,Parabola,,S86157014,"",,,,,Setophaga discolor,prawar,Species,32879,,2.00,1,"",,
347539401,Audio,Prairie Warbler,Setophaga discolor,"Passerina caerulea -- Blue Grosbeak; Dumetella carolinensis -- Gray Catbird; Troglodytes aedon -- House Wren; Passerina cyanea -- Indigo Bunting; Geothlypis trichas -- Common Yellowthroat; Turdus migratorius -- American Robin; Sayornis phoebe -- Eastern Phoebe; Spizella pusilla -- Field Sparrow",Brian Henderson,2021-06-05,2021,6,5,1037,United States,US-PA-091,Pennsylvania,Montgomery,Morwood Rd. Powerline Cut (restricted access),40.3217910,-75.4144164,"",Song,Not Used,"","",,,Nikon D500,,,,S89668959,"",,,,Heard.  Two birds countersinging from opposite sides of Morwood Rd.,Setophaga discolor,prawar,Species,32879,,3.00,1,"",,
347509341,Audio,Prairie Warbler,Setophaga discolor,"Vireo olivaceus -- Red-eyed Vireo; Spizella pusilla -- Field Sparrow",David McCartt,2021-06-13,2021,6,13,716,United States,US-NY-107,New York,Tioga,"Tubbs Hill Rd, Richford",42.3483635,-76.1646831,Adult Male – 1,Song,Not Used,"","",,,iPhone XS,iPhone XS,,,S90132317,"",,,,,Setophaga discolor,prawar,Species,32879,,4.00,1,"",,
346955501,Audio,Prairie Warbler,Setophaga discolor,"Dumetella carolinensis -- Gray Catbird; Agelaius phoeniceus -- Red-winged Blackbird",William Whitehead,2021-06-11,2021,6,11,800,United States,US-NJ-035,New Jersey,Somerset,Negri-Nepote Grasslands,40.4708700,-74.5229955,"","Courtship, Display, or Copulation; Song",Unspecified,"","",,,,,,,S90003138,"",,,Grassland,,Setophaga discolor,prawar,Species,33061,,4.00,1,"",,
346446391,Audio,Prairie Warbler,Setophaga discolor,"Dumetella carolinensis -- Gray Catbird; Setophaga pensylvanica -- Chestnut-sided Warbler; Melospiza melodia -- Song Sparrow; Setophaga petechia [aestiva Group] -- Yellow Warbler (Northern); Setophaga pinus -- Pine Warbler; Spinus tristis -- American Goldfinch",Christopher McPherson,2021-06-09,2021,6,9,615,United States,US-NH-011,New Hampshire,Hillsborough,"Lancy Brook wetlands, Brookline",42.7466592,-71.7079653,Adult Male – 1,"Foraging or Eating; Song",Not Used,"","",,,Sound Devices Mixpre 3 II,Sennheiser MKH20,Telinga Univ. MK II,,S89885791,"",,,,,Setophaga discolor,prawar,Species,32879,,4.00,1,"",,
346322041,Audio,Prairie Warbler,Setophaga discolor,,Rob Bielawski,2021-05-22,2021,5,22,659,United States,US-VA-550,Virginia,Chesapeake,Cavalier WMA,36.6008086,-76.3267576,"",Song,Not Used,"","",,,Samsung A51,,,,S88735397,"",,,,,Setophaga discolor,prawar,Species,32879,,3.00,1,"",,
346120321,Audio,Prairie Warbler,Setophaga discolor,,Dean Newhouse,2021-06-07,2021,6,7,825,United States,US-PA-133,Pennsylvania,York,Gifford Pinchot SP--northeast,40.0916122,-76.8704581,"",Song,Unspecified,"","",,,Canon SX60HS Powershot Camera,,,,S89791050,"",,,,,Setophaga discolor,prawar,Species,32879,,2.00,1,"",,
345809471,Audio,Prairie Warbler,Setophaga discolor,"Pipilo erythrophthalmus -- Eastern Towhee; Vireo griseus -- White-eyed Vireo; Passerina cyanea -- Indigo Bunting; Corvus brachyrhynchos -- American Crow; Zenaida macroura -- Mourning Dove",Carole Swann,2021-06-06,2021,6,6,1310,United States,US-TN-149,Tennessee,Rutherford,Welchance Road,35.7648102,-86.2915931,Adult Male – 1,Song,Not Used,"","",,,iPhone Xr,Built-in microphone,,,S89754430,"",,,"Other species are Eastern Towhee, WEVI, Indigo Bunting, American Crow, and Mourning Dove.  Male Prairie Warbler was in a small tree in a Cedar Glade area singing near the top of the tree.  This recording is of the bird in the photographs in this checklist. ",In a little glade area and all along the road.,Setophaga discolor,prawar,Species,32879,,2.00,1,"",,
345809461,Audio,Prairie Warbler,Setophaga discolor,"Thryothorus ludovicianus -- Carolina Wren; Cardinalis cardinalis -- Northern Cardinal",Carole Swann,2021-06-06,2021,6,6,1310,United States,US-TN-149,Tennessee,Rutherford,Welchance Road,35.7648102,-86.2915931,Unknown – 1,Song,Not Used,"","",,,iPhone Xr,Built-in microphone,,,S89754430,"",,,Other birds in this recording are Carolina Wren and Northern Cardinal.,In a little glade area and all along the road.,Setophaga discolor,prawar,Species,32879,,4.00,1,"",,
345673011,Audio,Prairie Warbler,Setophaga discolor,,Hannah  Mirando,2021-06-05,2021,6,5,859,United States,US-NY-103,New York,Suffolk,"Sammy's Beach",41.0290844,-72.1875189,Adult – 1,Song,Not Used,"","",,,Marantz PMD661 MKII,Sennheiser ME67,wind screen,,S89726677,"",,,"Bird sitting on the top of  cedar tree. Preened and then sang in between. At the end of the recording, flew down into a low bush and continued to sing.",,Setophaga discolor,prawar,Species,32879,,3.00,1,"",,
345660701,Audio,Prairie Warbler,Setophaga discolor,,Alex Lin-Moore,2021-06-06,2021,6,6,817,United States,US-CT-011,Connecticut,New London,"Hartman Park, Lyme, CT",41.4319095,-72.2873071,Adult Male – 1,Song,Not Used,"","",,,,,,,S89715590,"",,,,,Setophaga discolor,prawar,Species,32879,,4.00,1,"",,
345659521,Audio,Prairie Warbler,Setophaga discolor,"Turdus migratorius -- American Robin; Melanerpes carolinus -- Red-bellied Woodpecker; Spizella pusilla -- Field Sparrow; Colaptes auratus -- Northern Flicker; Setophaga americana -- Northern Parula",Brian Henderson,2021-05-03,2021,5,3,831,United States,US-PA-091,Pennsylvania,Montgomery,Hill Rd. at Powerline Cut,40.3405630,-75.4287922,"",Song,Not Used,"","",,,Nikon D500,,,,S87010320,"",,,,heard,Setophaga discolor,prawar,Species,32879,,2.00,1,"",,
345429151,Audio,Prairie Warbler,Setophaga discolor,"Troglodytes aedon -- House Wren; Turdus migratorius -- American Robin; Myiarchus crinitus -- Great Crested Flycatcher",Kriss Replogle,2021-06-05,2021,6,5,821,United States,US-NJ-019,New Jersey,Hunterdon,Frenchtown Preserve,40.5215730,-75.0475290,Adult – 1,Song,Not Used,"","",,,IPhone6s with RØDE Rec 2.9.46 & Audacity 2.3.2,,,,S89643364,"",,,,,Setophaga discolor,prawar,Species,32879,,2.00,1,"",,
345428221,Audio,Prairie Warbler,Setophaga discolor,,Lucas Schrader,2021-06-04,2021,6,4,844,United States,US-OH-031,Ohio,Coshocton,"Township Road 403, Coshocton US-OH 40.23914, -81.97812",40.2391400,-81.9781250,Adult Male – 1,Song,Used,"","",,,Zoom H5,Wildtronics Pro M/S,"22"" dish",,S89617927,"",,,"Individual singing from treetop perch, humans observing and chatting. The guide had used playback several minutes prior.",,Setophaga discolor,prawar,Species,32879,,2.00,1,"",,
345424651,Audio,Prairie Warbler,Setophaga discolor,"Pipilo erythrophthalmus -- Eastern Towhee; Baeolophus bicolor -- Tufted Titmouse",Kriss Replogle,2021-06-05,2021,6,5,751,United States,US-NJ-019,New Jersey,Hunterdon,Frenchtown Preserve,40.5215730,-75.0475290,Adult – 1,Song,Not Used,"","",,,IPhone6s with RØDE Rec 2.9.46 & Audacity 2.3.2,,,,S89642009,"",,,,,Setophaga discolor,prawar,Species,32879,,1.00,1,"",,
345167731,Audio,Prairie Warbler,Setophaga discolor,,David Bree,2021-06-04,2021,6,4,728,Canada,CA-ON-LA,Ontario,Lennox and Addington,Sheffield CA,44.5590717,-77.1170926,Adult Male – 1,Song,Not Used,"","",,,Nikon P900,,,,S89586460,"",,,,"Known location. Male singing on territory.  In rock barrens at top of hill on right fork.  Sang for awhile then stopped, then again and then third time.at different location right over trail.  Finally saw it at this location.  Into sun unfortunately but reasonable view.",Setophaga discolor,prawar,Species,32879,,4.00,2,"",,
345096511,Audio,Prairie Warbler,Setophaga discolor,"Turdus migratorius -- American Robin; Dumetella carolinensis -- Gray Catbird; Hylocichla mustelina -- Wood Thrush; Zenaida macroura -- Mourning Dove",James Saracco,2021-06-04,2021,6,4,757,United States,US-PA-003,Pennsylvania,Allegheny,"Boys Home Park, Oakdale US-PA 40.39562, -80.18018",40.3956170,-80.1801840,Adult Male – 1,Song,Not Used,"","",,,iphone,built-in phone mic,,,S89584714,"",,,,Singing along powerline,Setophaga discolor,prawar,Species,32879,,2.00,1,"",,
344868191,Audio,Prairie Warbler,Setophaga discolor,,David McCartt,2021-06-03,2021,6,3,640,United States,US-NY-107,New York,Tioga,"Tubbs Hill Rd, Richford",42.3483635,-76.1646831,Adult – 1,Song,Not Used,"","",,,iPhone XS,iPhone XS,,,S89535474,"",,,,,Setophaga discolor,prawar,Species,32879,,3.00,1,"",,
344572821,Audio,Prairie Warbler,Setophaga discolor,"Poecile atricapillus -- Black-capped Chickadee; Corvus brachyrhynchos -- American Crow; Zenaida macroura -- Mourning Dove; Turdus migratorius -- American Robin; Troglodytes aedon -- House Wren; Passerina cyanea -- Indigo Bunting",Dan Scheiman,2021-05-31,2021,5,31,518,United States,US-WI-029,Wisconsin,Door,"stakeout Prairie Warbler, Mathy Rd., Sturgeon Bay (2021)",44.8230000,-87.3155060,Adult Male – 1,Song,Not Used,"","",,,iPhone 7,,,,S89330756,"",,,,Singing. Continuing.,Setophaga discolor,prawar,Species,32879,,1.00,1,"",,
344572811,Audio,Prairie Warbler,Setophaga discolor,"Turdus migratorius -- American Robin; Corvus brachyrhynchos -- American Crow; Cardinalis cardinalis -- Northern Cardinal; Zenaida macroura -- Mourning Dove; Poecile atricapillus -- Black-capped Chickadee",Dan Scheiman,2021-05-31,2021,5,31,518,United States,US-WI-029,Wisconsin,Door,"stakeout Prairie Warbler, Mathy Rd., Sturgeon Bay (2021)",44.8230000,-87.3155060,Adult Male – 1,Song,Not Used,"","",,,iPhone 7,,,,S89330756,"",,,,Singing. Continuing.,Setophaga discolor,prawar,Species,32879,,1.00,1,"",,
