94645881,Audio,Prairie Warbler,Setophaga discolor,,Jeff McDonald,2018-04-15,2018,4,15,942,United States,US-PA-003,Pennsylvania,Allegheny,Hilltop Park,40.3899262,-80.1094300,Adult Male,Song,Not Used,"","",,,,,,,S44598163,"",,,,"Pics taken. Song recorded. Singing in the same spot as last year. Found by LN. <a href=""https://www.flickr.com/photos/jeff_mcdonald/41435632652/in/dateposted/"" title=""Prairie Warbler""><img src=""https://farm1.staticflickr.com/891/41435632652_5d72ea05aa_b.jpg"" alt=""Prairie Warbler"" /></a>",Setophaga discolor,prawar,Species,33061,,3.50,2,"",,
94484961,Audio,Prairie Warbler,Setophaga discolor,,Stephen McCullers,2018-04-07,2018,4,7,800,United States,US-FL-086,Florida,Miami-Dade,Bill Baggs Cape Florida SP,25.6733000,-80.1582000,Adult Male,Song,Not Used,"","",,,iPhone 6s,None,Twisted Wave App,,S44327339,"",,,,,Setophaga discolor,prawar,Species,33061,,3.00,2,"",,
94436201,Audio,Prairie Warbler,Setophaga discolor,,Ed Blitch,2018-04-14,2018,4,14,801,United States,US-SC-019,South Carolina,Charleston,Hyde Park Rd.,32.8205838,-80.2733908,"",Song,Not Used,"","",,,,,,,S44562125,"",,,,,Setophaga discolor,prawar,Species,32879,,2.00,1,"",,
93851121,Audio,Prairie Warbler,Setophaga discolor,,Paul Marvin,2018-04-10,2018,4,10,700,United States,US-FL-009,Florida,Brevard,Lori Wilson Park,28.3361402,-80.6083331,"","Flight Call; Song",Not Used,"","",,,Tascam HD-P2 portable recorder,Sennheiser MKH70,,,S44438785,"",,,,,Setophaga discolor,prawar,Species,32879,,2.50,2,"",,
93643341,Audio,Prairie Warbler,Setophaga discolor,,Jim Ferrari,2018-04-08,2018,4,8,1059,United States,US-GA-159,Georgia,Jasper,Piedmont NWR--Pond 2A,33.1479624,-83.7534984,Adult,Song,Not Used,"","",,,Olympus LS-10,,,,S44362887,"",,,Prairie Warbler -- heard only.,,Setophaga discolor,prawar,Species,32879,,3.00,2,"",,
93615641,Audio,Prairie Warbler,Setophaga discolor,,Franklin Diaz,2018-04-07,2018,4,7,1103,United States,US-GA-127,Georgia,Glynn,Jekyll Island--Campground,31.1047955,-81.4110518,"",Song,Not Used,"","",,,"iPhone6's Rode app",,,,S44388783,"",,,"Rising buzzy trill at 0, 8, 16, & 34sec; edited out noise &lt;1.5kHz.",Heard on trail entrance to Driftwood Beach,Setophaga discolor,prawar,Species,32879,,2.50,2,"",,
93150121,Audio,Prairie Warbler,Setophaga discolor,,Don Bemont,2018-04-06,2018,4,6,836,United States,US-NC-055,North Carolina,Dare,Alligator River National Wildlife Refuge -- Koehring Rd,35.8013030,-75.8474530,Adult,Song,Not Used,"","",,,Audio-Technica AT8015,Roland R26,,,S44292973,"",,,Does not sound typical to me.,"Being from the north, I get to hear Prairie Warblers very rarely, other than the first week of April each year, so I may not have a balanced experience of their repertoire -- but this one sounded to me more like a Black-throated Blue than it sounded like the many other Prairies I was hearing this week.  However, I located the bird (photo) and it is clearly a Prairie.",Setophaga discolor,prawar,Species,32879,,3.50,2,"",,
92728061,Audio,Prairie Warbler,Setophaga discolor,,Don Bemont,2018-04-03,2018,4,3,752,United States,US-NC-055,North Carolina,Dare,Alligator River National Wildlife Refuge - Butler Rd,35.8517740,-75.8817480,Adult,Song,Not Used,"","",,,Roland R26,Audio-Technica AT8015,,,S44214148,"",,,,,Setophaga discolor,prawar,Species,32879,,3.50,2,"",,
92598401,Audio,Prairie Warbler,Setophaga discolor,,Daniel Estabrooks,2018-04-01,2018,4,1,1100,United States,US-FL-105,Florida,Polk,Christ Community Church area,28.0150706,-81.6703784,"",Song,Unspecified,"","",,,LG K20 Plus phone,,,,S44196565,"",,,Whisper songs. This bird was about 10 feet away from me and singing very quietly. Note the different variations on the typical song of this species.,,Setophaga discolor,prawar,Species,32879,,3.00,2,"",,
92562891,Audio,Prairie Warbler,Setophaga discolor,,Liam Wolff,2018-04-02,2018,4,2,908,United States,US-GA-033,Georgia,Burke,Perkins Mill Road,33.2326302,-82.1976524,Adult Male,Song,Unspecified,"","",,,,,,,S44186836,"",,,,,Setophaga discolor,prawar,Species,32879,,2.00,2,"",,
92562871,Audio,Prairie Warbler,Setophaga discolor,,Liam Wolff,2018-04-02,2018,4,2,908,United States,US-GA-033,Georgia,Burke,Perkins Mill Road,33.2326302,-82.1976524,Adult Male,Song,Unspecified,"","",,,,,,,S44186836,"",,,,,Setophaga discolor,prawar,Species,32879,,4.00,4,"",,
92538681,Audio,Prairie Warbler,Setophaga discolor,,Alex Wiebe,2018-04-02,2018,4,2,652,United States,US-NC-055,North Carolina,Dare,Alligator NWR--Milltail Rd (forest),35.8245639,-75.8719254,"",Song,Not Used,"","",,,Sennheiser ME 62,Marantz PMD 661,Windscreen,,S44182385,"",,,,,Setophaga discolor,prawar,Species,32879,,3.00,2,"",,
92171741,Audio,Prairie Warbler,Setophaga discolor,,Don Bemont,2018-03-31,2018,3,31,942,United States,US-NC-055,North Carolina,Dare,Alligator River National Wildlife Refuge - Butler Rd,35.8517740,-75.8817480,Adult Male,Song,Not Used,"","",,,Roland R26,Audio-Technica AT8015,,,S44114615,"",,,,,Setophaga discolor,prawar,Species,32879,,2.50,2,"",,
92157571,Audio,Prairie Warbler,Setophaga discolor,,Mary Catherine Miguez,2018-03-31,2018,3,31,802,United States,US-VA-810,Virginia,Virginia Beach,US-VA-Virginia Beach-Backyard 36.7518x-75.9870,36.7518290,-75.9869920,Male,Song,Not Used,"","",,,iPhone,,,,S44113180,"",,,,"Noticed without bins a small yellow bird as soon as it pumped it’s tail, I ran for my bins and camera.  Singing adult male in breeding plumage will post pictures. I know I posted too many shots but it has been a LONG winter and I was super stoked to see this little guy!",Setophaga discolor,prawar,Species,32879,,3.00,2,"",,
91136301,Audio,Prairie Warbler,Setophaga discolor,,Scott  Connop,1992-06-01,1992,6,1,0,Canada,CA-ON-HA,Ontario,Hamilton,Flamborough--Rockton Tract,43.3169877,-80.1534382,Adult Male,Song,Not Used,"","",,,Sony TCM-5000,Sennheiser ME-66,,,S43847487,"",,,,"Audio archive LNS56648 This archive mistakenly attributes the first 1:23 to an alternate song of Prairie - it is actually Brewster's Warbler. See ML 91127681 above. The rest of the cut is classic Prairie.",Setophaga discolor,prawar,Species,32879,,4.00,2,"",,
91135791,Audio,Prairie Warbler,Setophaga discolor,,Scott  Connop,1992-06-01,1992,6,1,0,Canada,CA-ON-HA,Ontario,Hamilton,Flamborough--Rockton Tract,43.3169877,-80.1534382,Adult Male,Song,Used,"","",,,Sony TCM-5000,Sennheiser ME-66,,,S43847487,"",,,"Playback initiated a slight change in song, particularly in the terminal notes.","Audio archive LNS56648 This archive mistakenly attributes the first 1:23 to an alternate song of Prairie - it is actually Brewster's Warbler. See ML 91127681 above. The rest of the cut is classic Prairie.",Setophaga discolor,prawar,Species,32879,,5.00,2,"",,
89902221,Audio,Prairie Warbler,Setophaga discolor,,Gary Leavens,2018-03-14,2018,3,14,1254,United States,US-FL-087,Florida,Monroe,"US-FL-Everglades National Park (25.1369,-80.9397)",25.1369070,-80.9397060,Adult Male,Song,Not Used,"","",,,iPhone6,,,,S43646825,"",,,,,Setophaga discolor,prawar,Species,32879,,4.50,2,"",,
82410611,Audio,Prairie Warbler,Setophaga discolor,,Matt Dufort,2017-06-26,2017,6,26,814,United States,US-MA-001,Massachusetts,Barnstable,Sandy Neck,41.7353901,-70.3512096,"",Song,Not Used,"","",,,iPhone 6,,,,S37810183,"",,,,,Setophaga discolor,prawar,Species,32879,,3.50,2,"",,
79641361,Audio,Prairie Warbler,Setophaga discolor,,Andrew S. Aldrich,2011-06-22,2011,6,22,1020,United States,US-IL-043,Illinois,DuPage,Waterfall Glen Forest Preserve--Sawmill Creek Area,41.7058000,-87.9589000,"",Song,Not Used,"","",,,,,,,S8460495,"",,,,"Singing male, previously reported.",Setophaga discolor,prawar,Species,32879,,1.50,2,"",,
73975201,Audio,Prairie Warbler,Setophaga discolor,,David Stejskal,2012-05-29,2012,5,29,0,United States,US-AZ-019,Arizona,Pima,Sabino Dam and downstream riparian,32.3131068,-110.8113941,Adult Male,Song,Not Used,"","",,,Sony PCM-M10,built-in,,,S40276813,"",,,,,Setophaga discolor,prawar,Species,32879,,4.50,2,"",,
72847221,Audio,Prairie Warbler,Setophaga discolor,,Marshall Iliff,2017-04-30,2017,4,30,811,United States,US-ME-001,Maine,Androscoggin,Hallowell Rd. powerline (north)),43.9395810,-70.1531970,Adult Male,Song,Not Used,"","",,,iPhone 6SE,,RodeRec LE,,S36415634,"",,,,singing and seen well along powerline,Setophaga discolor,prawar,Species,32879,,3.00,2,"",,
72099081,Audio,Prairie Warbler,Setophaga discolor,,Gregory Budney,2008-05-17,2008,5,17,450,United States,US-NJ-009,New Jersey,Cape May,Belleplain SF,39.2354857,-74.8666440,Adult Male,Song,Not Used,"","",,,NAGRA ARES-BB+,Telinga Pro 6,Telinga Parabola 54.7cm/15.5cm (21.5in/6.1in),,S39962659,"",,,Type I song recorded in stereo at 0635hrs.,,Setophaga discolor,prawar,Species,32879,,4.00,2,"",,
66896681,Audio,Prairie Warbler,Setophaga discolor,,Paul Marvin,2013-05-23,2013,5,23,545,United States,US-KY-061,Kentucky,Edmonson,Mammoth Cave NP-- Edmonson Co.,37.1976132,-86.1254662,"",Song,Not Used,"","",,,Tascam HD-P2 potable recorder,Sennheiser MKH70,,,S38799804,"",,,,,Setophaga discolor,prawar,Species,32879,,3.50,2,"",,
65703411,Audio,Prairie Warbler,Setophaga discolor,,Paul Marvin,2014-05-23,2014,5,23,700,United States,US-FL-087,Florida,Monroe,Saddlebunch Keys,24.5977000,-81.5833800,Adult,Song,Not Used,"","",,,Tascam HD-P2 potable recorder,Sennheiser MKH70,,,S38575838,"",,,,,Setophaga discolor,prawar,Species,32879,,3.50,2,"",,
65637471,Audio,Prairie Warbler,Setophaga discolor,,Jeremy Collison,2017-04-06,2017,4,6,851,United States,US-FL-087,Florida,Monroe,Everglades NP--Flamingo,25.1416000,-80.9255000,Adult Male,Song,Not Used,"","",,,Marantz PMD 661,Sennheiser ME 67,,,S35862326,"",,,9:12 am,,Setophaga discolor,prawar,Species,32879,,2.00,2,"",,
64515591,Audio,Prairie Warbler,Setophaga discolor,,Gregory Budney,2000-05-29,2000,5,29,715,United States,US-NY-109,New York,Tompkins,Roy H. Park Preserve--north (FLLT),42.4339256,-76.3209647,Adult Male,"Non-vocal; Song",Not Used,"","",,,HHB PORTADAT PDR 1000,Sennheiser MKH 20,Telinga Parabola 54.7cm/15.5cm (21.5in/6.1in),,S38357862,"",,,Type II song and wing sounds recorded beginning at 0848 and ending at 0952hrs.,,Setophaga discolor,prawar,Species,32879,,4.00,2,"",,
64515561,Audio,Prairie Warbler,Setophaga discolor,,Gregory Budney,2000-05-29,2000,5,29,715,United States,US-NY-109,New York,Tompkins,Roy H. Park Preserve--north (FLLT),42.4339256,-76.3209647,Adult Male,"Non-vocal; Song",Not Used,"","",,,HHB PORTADAT PDR 1000,Sennheiser MKH 20,Telinga Parabola 54.7cm/15.5cm (21.5in/6.1in),,S38357862,"",,,Type II song and wing sounds recorded at 0830hrs.  Believed to be the same individual as the focal bird in ML64515551.  Second male Prairie Warbler is heard singing Type II song in the background of the first section of this recording.  Note that though this recording is likely the same individual as ML64515551 a different parabolic microphone system was used for this recording.  150 Hz low cut filter used on this archival copy.,,Setophaga discolor,prawar,Species,32879,,4.00,2,"",,
64515551,Audio,Prairie Warbler,Setophaga discolor,,Gregory Budney,2000-05-29,2000,5,29,715,United States,US-NY-109,New York,Tompkins,Roy H. Park Preserve--north (FLLT),42.4339256,-76.3209647,Adult Male,Song,Not Used,"","",,,HHB PORTADAT PDR 1000,Sennheiser MKH 40,Roché Parabola 74cm/17.7cm (29.1in/7in),,S38357862,"",,,Type I song recorded at 0745hrs.  150 Hz low cut filter used for archival copy.,,Setophaga discolor,prawar,Species,32879,,3.50,2,"",,
64515531,Audio,Prairie Warbler,Setophaga discolor,,Gregory Budney,2000-05-29,2000,5,29,715,United States,US-NY-109,New York,Tompkins,Roy H. Park Preserve--north (FLLT),42.4339256,-76.3209647,Adult Male,Song,Not Used,"","",,,HHB PORTADAT PDR 1000,Sennheiser MKH 40,Roché Parabola 74cm/17.7cm (29.1in/7in),,S38357862,"",,,Type II song recorded at 0730hrs.  150 Hz low cut filter used for archival copy.,,Setophaga discolor,prawar,Species,32879,,3.00,2,"",,
63602711,Audio,Prairie Warbler,Setophaga discolor,,Carlos Funes,2017-06-18,2017,6,18,555,United States,US-NY-097,New York,Schuyler,Arnot Forest (Schuyler Co.),42.2831722,-76.6559494,Adult,Song,Not Used,"","",,,Marantz PMD 661,Sennheiser ME 62,"Telinga 22"" Parabola",,S37814637,"",,,Single individual singing from the top of Araucaria tree.,Singing in Irish Hill field,Setophaga discolor,prawar,Species,32879,,3.50,2,"",,
63602701,Audio,Prairie Warbler,Setophaga discolor,,Carlos Funes,2017-06-18,2017,6,18,555,United States,US-NY-097,New York,Schuyler,Arnot Forest (Schuyler Co.),42.2831722,-76.6559494,Adult,Song,Not Used,"","",,,Marantz PMD 661,Sennheiser ME 62,Sennheiser ME 62,,S37814637,"",,,Single individual singing from the top of Araucaria tree. Same individual.,Singing in Irish Hill field,Setophaga discolor,prawar,Species,32879,,4.50,2,"",,
63531681,Audio,Prairie Warbler,Setophaga discolor,,Joseph Fell,2017-07-16,2017,7,16,1630,United States,US-NY-009,New York,Cattaraugus,Hilliker Rd,42.4728313,-78.5680389,"",Song,Unspecified,"","",,,iPhone 7,,,,S38175063,"",,,,,Setophaga discolor,prawar,Species,32879,,3.00,2,"",,
63147701,Audio,Prairie Warbler,Setophaga discolor,,Kevin Vande Vusse,2017-07-11,2017,7,11,1010,United States,US-MI-021,Michigan,Berrien,Warren Dunes SP,41.9024285,-86.5982959,Adult Male,Song,Not Used,"","",,,Canon 70D,,,,S38098457,"",,,,Birds singing in dune area in-between trail markers 13 and 14.,Setophaga discolor,prawar,Species,32879,,2.33,3,"",,
62976021,Audio,Prairie Warbler,Setophaga discolor,,Alan Buriak,2017-07-09,2017,7,9,715,United States,US-PA-003,Pennsylvania,Allegheny,Imperial Grasslands--King Rd,40.4485374,-80.3170340,Adult Male,Song,Not Used,"","",,,Samsung Galaxy S6 (RecForge II Pro app),,,,S38045754,"",,,"PRWA song at 0:03 and 0:15, other species include NOCA and EATO","Singing continuously from edge of recently cleared area, bird then moved to some larger trees next to road for great views, with the clearing of the previous breeding area down the road, it seems that this species has pretty much run out of habitat here and is pushed right up against the forest.  Does this shaky video show the last breeding Prairie Warbler in Allegheny County?  <iframe width=""560"" height=""315"" src=""https://www.youtube.com/embed/8Ba9PsY8DTw"" frameborder=""0""></iframe>",Setophaga discolor,prawar,Species,32879,,2.00,2,"",,
62929611,Audio,Prairie Warbler,Setophaga discolor,,Brian Henderson,2015-05-07,2015,5,7,753,United States,US-PA-091,Pennsylvania,Montgomery,Evansburg SP--Mill Rd. to Rte. 73 (Day Use Area/Lesher),40.1994676,-75.4040945,"",Song,Not Used,"","",,,Canon Powershot SX60,,,,S23286073,"",,,"Other species: Wood Thrush, Gray Catbird, Yellow Warbler.","FOY.  On breeding territory at Lesher Rd, singing their heads off.  <iframe width=""560"" height=""315"" src=""https://www.youtube.com/embed/TllGU1ZBq3c?rel&#61;0"" frameborder=""0""></iframe>",Setophaga discolor,prawar,Species,32879,,4.00,2,"",,
62895541,Audio,Prairie Warbler,Setophaga discolor,,Damon Haan,2016-06-03,2016,6,3,1703,United States,US-MI-069,Michigan,Iosco,"Lumberman's Monument",44.4349596,-83.6237562,Adult Male,Song,Unspecified,"","",,,,,,,S30059457,"",,,,Continuing,Setophaga discolor,prawar,Species,32879,,3.50,2,"",,
62895531,Audio,Prairie Warbler,Setophaga discolor,,Damon Haan,2016-06-03,2016,6,3,1703,United States,US-MI-069,Michigan,Iosco,"Lumberman's Monument",44.4349596,-83.6237562,Adult Male,Song,Unspecified,"","",,,,,,,S30059457,"",,,,Continuing,Setophaga discolor,prawar,Species,32879,,4.00,2,"",,
62522901,Audio,Prairie Warbler,Setophaga discolor,,Guillermo Funes,2017-06-18,2017,6,18,555,United States,US-NY-097,New York,Schuyler,Arnot Forest (Schuyler Co.),42.2831722,-76.6559494,Adult,Song,Not Used,"","",,,Roland R-26,Sennheiser ME 62,"Telinga 22"" Parabola",,S37832272,"",,,,Singing in Irish Hill field,Setophaga discolor,prawar,Species,32879,,4.00,2,"",,
62502671,Audio,Prairie Warbler,Setophaga discolor,,Guillermo Funes,2017-06-18,2017,6,18,555,United States,US-NY-097,New York,Schuyler,Arnot Forest (Schuyler Co.),42.2831722,-76.6559494,Unknown,Song,Not Used,"","",,,Roland R-26,Sennheiser ME 62,"Telinga 22"" Parabola",,S37832272,"",,,,Singing in Irish Hill field,Setophaga discolor,prawar,Species,32879,,3.50,2,"",,
62382421,Audio,Prairie Warbler,Setophaga discolor,,Glen Chapman,2017-06-18,2017,6,18,555,United States,US-NY-097,New York,Schuyler,Arnot Forest (Schuyler Co.),42.2831722,-76.6559494,Unknown,Song,Not Used,"","",,,Roland R-26,Sennheiser ME 62,"Telinga 22"" Parabola",,S37707758,"",,,,Singing in Irish Hill field,Setophaga discolor,prawar,Species,32879,,3.00,2,"",,
62354061,Audio,Prairie Warbler,Setophaga discolor,,Steve Kelling,2017-07-01,2017,7,1,838,United States,US-NY-109,New York,Tompkins,"Boyer Creek Farm, Caroline",42.3432727,-76.2994856,Adult Male,Song,Not Used,"","",,,Marantz PMD 661 MK II,Sennheiser ME67/K6 - Spot Shotgun Mic Caps,Rycote Standard Hole Softie with Mount and Pistol Grip,,S37901995,"",,,"Male singing from several perches in Christmas tree plantation. Other birds: Purple Finch, American Goldfinch, Red-eyed Vireo, Song Sparrow, Common Yellowthroat, Indigo Bunting, Eastern Towhee",,Setophaga discolor,prawar,Species,32879,,2.50,2,"",,
62282641,Audio,Prairie Warbler,Setophaga discolor,,Roseanna Denton,2017-06-30,2017,6,30,859,United States,US-KY-199,Kentucky,Pulaski,Bee Rock DBNF (Pulaski Co.),37.0284154,-84.3183509,"",Song,Not Used,"","",,,iphone 6,,,,S37887807,"",,,,,Setophaga discolor,prawar,Species,32879,,3.00,2,"",,
62211531,Audio,Prairie Warbler,Setophaga discolor,,Julianne Warren,2017-06-18,2017,6,18,555,United States,US-NY-097,New York,Schuyler,Arnot Forest (Schuyler Co.),42.2831722,-76.6559494,Unknown,Song,Not Used,"","",,,Marantz PMD 661,shotgun Sennheiser ME 67,,,S37677606,"",,,"recorded w/ low cut filter, grove of spruce in old field, 8:40am, 70ish F, part clouds, breezy, followed bird as seen moving around tops of trees, also song sparrow chipping, redwing blackbirds...",Singing in Irish Hill field,Setophaga discolor,prawar,Species,32879,,3.50,2,"",,
62031671,Audio,Prairie Warbler,Setophaga discolor,,Dave Slager,2017-06-11,2017,6,11,605,United States,US-MI-005,Michigan,Allegan,Oval Beach,42.6640086,-86.2162399,"",Song,Not Used,"","",,,iPod touch 5th generation,,,,S37542063,"",,,,Singing and seen in foredune area just S of Oval Beach property.  Recordings.,Setophaga discolor,prawar,Species,32879,,2.50,2,"",,
62008991,Audio,Prairie Warbler,Setophaga discolor,,Jay McGowan,2017-06-18,2017,6,18,555,United States,US-NY-097,New York,Schuyler,Arnot Forest (Schuyler Co.),42.2831722,-76.6559494,Adult Male,Song,Not Used,"","",,,Marantz PMD 661,Sennheiser ME 67,,,S37670613,"",,,,Singing in Irish Hill field,Setophaga discolor,prawar,Species,32879,,3.00,2,"",,
61987661,Audio,Prairie Warbler,Setophaga discolor,,Jeff Wells,2017-06-25,2017,6,25,1800,United States,US-ME-015,Maine,Lincoln,"Old gravel pit-Palmer Rd, Whitefield US-ME (44.1301,-69.6481)",44.1301490,-69.6480820,Adult Male,Song,Used,"","",,,iPhone,internal mic,,,S37799978,"",,,,,Setophaga discolor,prawar,Species,32879,,2.00,1,"",,
61900571,Audio,Prairie Warbler,Setophaga discolor,,Jon Evans,2017-06-25,2017,6,25,1157,United States,US-IL-031,Illinois,Cook,Little Red Schoolhouse Nature Center,41.7091550,-87.8770047,"",Song,Not Used,"","",,,iPhone,,,,S37795077,"",,,PAWA,Yellow warbler with heavy dark streaking on sides reddish on the back.,Setophaga discolor,prawar,Species,32879,,2.00,2,"",,
61827261,Audio,Prairie Warbler,Setophaga discolor,,John van Dort,2017-06-18,2017,6,18,555,United States,US-NY-097,New York,Schuyler,Arnot Forest (Schuyler Co.),42.2831722,-76.6559494,"",Song,Not Used,"","",,,Marantz PMD 661,Sennheiser ME 62,"Telinga 22"" Parabola",,S37677490,"",,,,Singing in Irish Hill field,Setophaga discolor,prawar,Species,32879,,3.50,2,"",,
61695501,Audio,Prairie Warbler,Setophaga discolor,,Davida Kalina,2017-06-22,2017,6,22,1036,United States,US-IL-031,Illinois,Cook,Little Red Schoolhouse Nature Center,41.7091550,-87.8770047,Adult Male,Song,Not Used,"","",,,Motorola Droid Turbo 2,,,,S37738012,"",,,"Male singing twice (near beginning and end of clip), with plenty of background noise","Continuing, heard singing repeatedly, audio recorded",Setophaga discolor,prawar,Species,32879,,2.00,2,"",,
61672421,Audio,Prairie Warbler,Setophaga discolor,,Ramit Singal,2017-06-18,2017,6,18,555,United States,US-NY-097,New York,Schuyler,Arnot Forest (Schuyler Co.),42.2831722,-76.6559494,Adult,Song,Not Used,"","",,,Tascam DR40,Sennheiser MKH 20,"Telinga 22"" parabola",,S37674377,"",,,2 separate recordings of the same bird at 0615hrs.,Singing in Irish Hill field,Setophaga discolor,prawar,Species,32879,,4.00,2,"",,
61549171,Audio,Prairie Warbler,Setophaga discolor,,Dave Slager,2017-06-18,2017,6,18,555,United States,US-NY-097,New York,Schuyler,Arnot Forest (Schuyler Co.),42.2831722,-76.6559494,"",Song,Not Used,"","",,,Marantz PMD661,Sennheiser ME62,"Telinga 22"" Parabola",,S37685614,"",,,Natural song from seen bird at 8:06am. Highpass filter 250 Hz in Adobe Audition. Different individual from ML61549061,Singing in Irish Hill field,Setophaga discolor,prawar,Species,32879,,4.00,2,"",,
61549061,Audio,Prairie Warbler,Setophaga discolor,,Dave Slager,2017-06-18,2017,6,18,555,United States,US-NY-097,New York,Schuyler,Arnot Forest (Schuyler Co.),42.2831722,-76.6559494,"",Song,Not Used,"","",,,Marantz PMD661,Sennheiser ME62,"Telinga 22"" Parabola",,S37685614,"",,,Natural song from seen bird at 6:49am. Highpass filter 250 Hz in Adobe Audition. Different individual from ML61549171,Singing in Irish Hill field,Setophaga discolor,prawar,Species,32879,,4.50,2,"",,
61544241,Audio,Prairie Warbler,Setophaga discolor,,Jay McGowan,2017-05-18,2017,5,18,706,United States,US-NY-109,New York,Tompkins,Lindsay-Parsons Biodiversity Preserve (FLLT),42.3101677,-76.5216895,Adult Male,Song,Not Used,"","",,,Marantz PMD 661,Telinga Pro 6,"Telinga 22"" Parabola",,S36956025,"",,,,,Setophaga discolor,prawar,Species,32879,,4.50,2,"",,
61519891,Audio,Prairie Warbler,Setophaga discolor,,Fabricio Gorleri,2017-06-18,2017,6,18,555,United States,US-NY-097,New York,Schuyler,Arnot Forest (Schuyler Co.),42.2831722,-76.6559494,Adult Male,Song,Not Used,"","",,,Marantz PMD661,Parabola Telinga 22,,,S37671720,"",,,,Singing in Irish Hill field,Setophaga discolor,prawar,Species,32879,,4.00,2,"",,
61519881,Audio,Prairie Warbler,Setophaga discolor,,Fabricio Gorleri,2017-06-18,2017,6,18,555,United States,US-NY-097,New York,Schuyler,Arnot Forest (Schuyler Co.),42.2831722,-76.6559494,Adult Male,Song,Not Used,"","",,,Marantz PMD661,,Parabola Telinga 22,,S37671720,"",,,Short cut,Singing in Irish Hill field,Setophaga discolor,prawar,Species,32879,,4.50,2,"",,
61311911,Audio,Prairie Warbler,Setophaga discolor,,Manuel Morales,2017-06-17,2017,6,17,930,United States,US-MA-003,Massachusetts,Berkshire,Taconic Trail State Park--Sarah Tenney Trailhead,42.7128634,-73.2421160,Adult Male,Song,Not Used,"","",,,TASCAM DR-100,,,,S37639682,"",,,,,Setophaga discolor,prawar,Species,32879,,4.33,3,"",,
61284231,Audio,Prairie Warbler,Setophaga discolor,,Bates Estabrooks,2017-06-17,2017,6,17,715,United States,US-TN-001,Tennessee,Anderson,Coal County Rd.--Cross Mt. Summit,36.1975512,-84.2294633,"",Song,Not Used,"","",,,,,,,S37640422,"",,,Three heard.  Two in this recording.,,Setophaga discolor,prawar,Species,32879,,3.00,3,"",,
61231881,Audio,Prairie Warbler,Setophaga discolor,,Daniel Lane,2017-06-14,2017,6,14,743,United States,US-LA-091,Louisiana,St. Helena,Museum Rd near Archie Kilcreese Rd,30.8838840,-90.7125560,Adult Male,"Call; Song",Used,"","",,,,,,,S37612998,"",,,,,Setophaga discolor,prawar,Species,32879,,2.50,2,"",,
61231861,Audio,Prairie Warbler,Setophaga discolor,,Daniel Lane,2017-06-14,2017,6,14,743,United States,US-LA-091,Louisiana,St. Helena,Museum Rd near Archie Kilcreese Rd,30.8838840,-90.7125560,"","Call; Song",Used,"","",,,,,,,S37612998,"",,,Begging calls from young and some songs from presumed male of family.,,Setophaga discolor,prawar,Species,32879,,3.50,2,"",,
61141991,Audio,Prairie Warbler,Setophaga discolor,,Isaac  Denzer,2017-06-04,2017,6,4,1058,United States,US-NH-019,New Hampshire,Sullivan,"Moody Park, Claremont",43.3600089,-72.3684454,Adult Male,Song,Not Used,"","",,,,,,,S37379067,"",,,,"Singing, pics.",Setophaga discolor,prawar,Species,32879,,3.50,2,"",,
60886961,Audio,Prairie Warbler,Setophaga discolor,,Mary McKitrick,2017-06-12,2017,6,12,534,United States,US-MA-015,Massachusetts,Hampshire,Mt Tom State Reservation--West Entrance,42.2400118,-72.6513112,Adult Male,Song,Not Used,"","",,,iPhone,,,,S37545869,"",,,,,Setophaga discolor,prawar,Species,32879,,4.50,2,"",,
60843541,Audio,Prairie Warbler,Setophaga discolor,,Kyle Lima,2017-06-10,2017,6,10,905,United States,US-ME-027,Maine,Waldo,North Dixmont Road Power Lines,44.7060910,-69.2137660,"",Song,Not Used,"","",,,iPhone S,,,,S37504538,"",,,,Photos and audio recording obtained and will be added.,Setophaga discolor,prawar,Species,32879,,2.50,2,"",,
60516251,Audio,Prairie Warbler,Setophaga discolor,,Dean Newhouse,2017-06-07,2017,6,7,1420,United States,US-PA-133,Pennsylvania,York,Gifford Pinchot SP--Boat Launch #2,40.0825987,-76.8834025,"",Song,Unspecified,"","",,,,,,,S37458897,"",,,"Prairie Warbler can be heard at 11-12 seconds, and at 22-23, 38-40 and 53-55 seconds.",,Setophaga discolor,prawar,Species,32879,,3.50,2,"",,
60374151,Audio,Prairie Warbler,Setophaga discolor,,Carolyn Fields,2017-06-04,2017,6,4,1356,United States,US-IL-097,Illinois,Lake,Illinois Beach SP--North Unit/Camp Logan,42.4667000,-87.8015000,"",Song,Not Used,"","",,,Canon SD1100 in video mode,,,,S37417519,"",,,,Heard just west of Burnett Ave. about half way between 17th St. and 21st St.,Setophaga discolor,prawar,Species,32879,,3.50,2,"",,
60322471,Audio,Prairie Warbler,Setophaga discolor,,David Gibson,2017-06-04,2017,6,4,1400,United States,US-VA-131,Virginia,Northampton,Magothy Bay Natural Area Preserve,37.1524498,-75.9502029,Male,Song,Not Used,"","",,,Tascam DR-05,,handle and wind screen,,S37406785,"",,,,,Setophaga discolor,prawar,Species,32879,,3.33,3,"",,
