241653121,Audio,Prairie Warbler,Setophaga discolor,,John Beetham,2020-06-06,2020,6,6,919,United States,US-NJ-023,New Jersey,Middlesex,Delaware and Raritan Canal SP-- Kingston Trails (Mapleton Preserve),40.3687679,-74.6154140,"",Song,Unspecified,"","",,,,,,,S70123541,"",,,,,Setophaga discolor,prawar,Species,32879,,2.00,1,"",,
241612011,Audio,Prairie Warbler,Setophaga discolor,Cardinalis cardinalis -- Northern Cardinal,Bente Torvund,2020-06-04,2020,6,4,1019,United States,US-FL-021,Florida,Collier,Marco Island--Tiger Tail Beach,25.9480980,-81.7445600,Adult Male – 1,Song,Not Used,"","",,,,,,,S70046438,"",,,,,Setophaga discolor,prawar,Species,32879,,2.00,1,"",,
241611731,Audio,Prairie Warbler,Setophaga discolor,"Charadrius wilsonia -- Wilson's Plover; Charadrius vociferus -- Killdeer",Bente Torvund,2020-06-04,2020,6,4,723,United States,US-FL-021,Florida,Collier,Marco Island--Tiger Tail Beach,25.9480980,-81.7445600,Adult Male – 1,Song,Unspecified,"","",,,,,,,S70041971,"",,,,,Setophaga discolor,prawar,Species,32879,,2.00,1,"",,
241473531,Audio,Prairie Warbler,Setophaga discolor,"Pipilo erythrophthalmus -- Eastern Towhee; Chordeiles minor -- Common Nighthawk",Ian Carlsen,2020-06-05,2020,6,5,1850,United States,US-ME-031,Maine,York,Waterboro Barrens Preserve (TNC),43.6095496,-70.7996667,Adult – 1,Song,Unspecified,"","",,,,,,,S70100516,"",,,,Many birds heard in meadow by parking lot and along trail to river. Aside from towhee it was the most common bird seemingly. Took pains not to count twice.,Setophaga discolor,prawar,Species,32879,,2.00,1,"",,
241412481,Audio,Prairie Warbler,Setophaga discolor,,Steven Mlodinow,2020-06-05,2020,6,5,453,United States,US-NE-105,Nebraska,Kimball,Oliver Reservoir SRA,41.2285718,-103.8267231,Immature Male – 1,Song,Unspecified,"","",,,,,,,S70093760,"",,,,Photos and recorded,Setophaga discolor,prawar,Species,33061,,2.00,2,"",,
241212301,Audio,Prairie Warbler,Setophaga discolor,"Empidonax alnorum -- Alder Flycatcher; Spizella pusilla -- Field Sparrow; Pipilo erythrophthalmus -- Eastern Towhee",Joel Tilley,2020-06-04,2020,6,4,710,United States,US-VT-021,Vermont,Rutland,"VAST Trail, Poultney, Vermont, US (43.529, -73.213)",43.5287596,-73.2130133,Adult Male – 1,Song,Not Used,"","",,,Google Pixel phone,Comica CVM-VS08,,,S70081297,"",,,,"After two weeks of hearing this rising buzzy trill, I finally saw one, in a brushy meadow.",Setophaga discolor,prawar,Species,32879,,3.00,1,"",,
240938161,Audio,Prairie Warbler,Setophaga discolor,"Geothlypis trichas -- Common Yellowthroat; Passerina caerulea -- Blue Grosbeak; Pipilo erythrophthalmus -- Eastern Towhee",Anne Armstrong,2020-06-03,2020,6,3,905,United States,US-GA-169,Georgia,Jones,Piedmont NWR--Little Rock Wildlife Dr.,33.0920018,-83.7189102,"",Song,Not Used,"","",,,"LG V50, RecForge app ",,,,S70012724,"",,,,,Setophaga discolor,prawar,Species,32879,,3.00,1,"",,
240872561,Audio,Prairie Warbler,Setophaga discolor,,Brian Tinker,2020-06-03,2020,6,3,1711,United States,US-OH-153,Ohio,Summit,Cuyahoga Valley NP--Virginia Kendall Lake and Trails,41.2170095,-81.5253997,Adult Male – 2,Song,Unspecified,"","",,,Nikon P950,,,,S70020927,"",,,,"Two males countersinging  <iframe width=""560"" height=""315"" src=""https://www.youtube.com/embed/T5H-S_F3yXU"" frameborder=""0""></iframe>  <iframe width=""560"" height=""315"" src=""https://www.youtube.com/embed/pWeKvYA4gXM"" frameborder=""0""></iframe>",Setophaga discolor,prawar,Species,32879,,3.00,1,"",,
240872491,Audio,Prairie Warbler,Setophaga discolor,,Brian Tinker,2020-06-03,2020,6,3,1711,United States,US-OH-153,Ohio,Summit,Cuyahoga Valley NP--Virginia Kendall Lake and Trails,41.2170095,-81.5253997,Adult Male – 2,Song,Unspecified,"","",,,Nikon P950,,,,S70020927,"",,,,"Two males countersinging  <iframe width=""560"" height=""315"" src=""https://www.youtube.com/embed/T5H-S_F3yXU"" frameborder=""0""></iframe>  <iframe width=""560"" height=""315"" src=""https://www.youtube.com/embed/pWeKvYA4gXM"" frameborder=""0""></iframe>",Setophaga discolor,prawar,Species,32879,,3.00,1,"",,
240855821,Audio,Prairie Warbler,Setophaga discolor,,Eric Zawatski,2020-06-03,2020,6,3,1247,United States,US-PA-081,Pennsylvania,Lycoming,Noltee Hill Rd,41.2149100,-77.2946530,Adult Male – 1,Song,Unspecified,"","",,,,,,,S70012919,"",,,,"&#x1f534;",Setophaga discolor,prawar,Species,32879,,4.50,2,"",,
240843801,Audio,Prairie Warbler,Setophaga discolor,,Dean Newhouse,2020-06-03,2020,6,3,841,United States,US-PA-133,Pennsylvania,York,Gifford Pinchot SP--northeast,40.0916122,-76.8704581,"",Song,Unspecified,"","",,,Motorola Moto G6 Plus cellphone with RecForge II app.,,,,S70005526,"",,,,,Setophaga discolor,prawar,Species,32879,,3.00,1,"",,
240633471,Audio,Prairie Warbler,Setophaga discolor,Geothlypis trichas -- Common Yellowthroat,Susan Elliott,2020-06-02,2020,6,2,1434,United States,US-VT-021,Vermont,Rutland,"Money Hole Rd, Benson",43.6989462,-73.3460045,"",Song,Not Used,"","",,,,,,,S69982896,"",,,,,Setophaga discolor,prawar,Species,32879,,3.00,1,"",,
240615251,Audio,Prairie Warbler,Setophaga discolor,Corvus brachyrhynchos -- American Crow,Aimee Lusty,2020-06-01,2020,6,1,546,United States,US-NY-103,New York,Suffolk,"Sammy's Beach",41.0290844,-72.1875189,Adult Male – 1,Song,Unspecified,"","",,,Zoom H4N Pro,Sennheiser ME67 Microphone,,,S69924235,"",,,"Male Prairie Warbler in a Juniperus Virginiana, windy morning. ",,Setophaga discolor,prawar,Species,32879,,3.50,2,"",,
240597021,Audio,Prairie Warbler,Setophaga discolor,"Passerina cyanea -- Indigo Bunting; Icteria virens -- Yellow-breasted Chat",Martin Wall,2020-05-31,2020,5,31,532,United States,US-NC-157,North Carolina,Rockingham,Dan River Game Land--Woodpecker Rd.,36.4437600,-79.7915100,Adult Male – 1,Song,Not Used,"","",,,iPhone 5s,,,,S69879022,"",,,,,Setophaga discolor,prawar,Species,32879,,2.00,1,"",,
240563071,Audio,Prairie Warbler,Setophaga discolor,,Don Gorney,2020-06-02,2020,6,2,1016,United States,US-IN-095,Indiana,Madison,Green Township Community Park,39.9499130,-85.8446145,Adult Male – 1,Song,Not Used,"","",,,,,,,S69968439,"",,,Recording edited to remove bumps to microphone.,,Setophaga discolor,prawar,Species,32879,,2.00,1,"",,
240457591,Audio,Prairie Warbler,Setophaga discolor,,K Springer,2020-06-01,2020,6,1,1644,United States,US-PA-085,Pennsylvania,Mercer,Spring Rd.,41.1584379,-80.1921514,Adult Male – 1,Song,Not Used,"","",,,Samsung Galaxy cell phone,Voice Recorder,,,S69948733,"",,,The wind picked up...,"Singing at ""exactly"" where I (Kim) stopped the car! What luck. Found immediately. FOY.",Setophaga discolor,prawar,Species,32879,,2.00,2,"",,
240426511,Audio,Prairie Warbler,Setophaga discolor,"Catharus fuscescens -- Veery; Vireo olivaceus -- Red-eyed Vireo; Geothlypis trichas -- Common Yellowthroat; Spizella pusilla -- Field Sparrow",Kevin Hannah,2015-06-22,2015,6,22,1013,Canada,CA-ON-LA,Ontario,Lennox and Addington,North Kaladar rock barrens CR 41,44.6748566,-77.1439834,Adult Male – 1,Song,Not Used,"","",,,Nagra,Sennheiser ME66,,,S24081829,"",,,"Close, heavy traffic",Two counter-singing males. Recordings made. Both observed at close range. Ample suitable habitat. Observed previously at this location.,Setophaga discolor,prawar,Species,32879,,3.00,1,"",,
240113501,Audio,Prairie Warbler,Setophaga discolor,Vireo flavifrons -- Yellow-throated Vireo,valerie heemstra,2020-05-31,2020,5,31,640,United States,US-NY-119,New York,Westchester,Teatown Lake Reservation,41.2133357,-73.8296217,Adult Male – 1,"Foraging or Eating; Song",Not Used,"","",,,Sound Devices MIXPRE-3,Sennheiser Omni K6,22 inch parabola,,S69900752,"",,,"This is a different bird, half way down Teatown Hill on the Green/Orange trail.  Filt. @ 100 Hz, not amp. norm.",,Setophaga discolor,prawar,Species,32879,,3.00,1,"",,
240108841,Audio,Prairie Warbler,Setophaga discolor,,valerie heemstra,2020-05-31,2020,5,31,640,United States,US-NY-119,New York,Westchester,Teatown Lake Reservation,41.2133357,-73.8296217,Adult Male – 1,Song,Not Used,"","",,,Sound Devices MIXPRE-3,Sennheiser Omni K6,22 inch parabola,,S69900752,"",,,"This is the song of the same bird in the photos.  It was less than 10 feet from me.  Crickets.  3 songs and then it flew.  Filt. @ 100 Hz, not amp. norm.",,Setophaga discolor,prawar,Species,32879,,3.00,1,"",,
240046611,Audio,Prairie Warbler,Setophaga discolor,Geothlypis trichas -- Common Yellowthroat,Kriss Replogle,2020-05-31,2020,5,31,907,United States,US-NJ-019,New Jersey,Hunterdon,Frenchtown Preserve,40.5215730,-75.0475290,Adult – 1,Song,Not Used,"","",,,IPhone6s with RØDE Rec 2.9.46 & Audacity 2.3.2,,,,S69881920,"",,,,,Setophaga discolor,prawar,Species,32879,,3.00,1,"",,
239780601,Audio,Prairie Warbler,Setophaga discolor,,Brad Walker,2020-05-30,2020,5,30,705,United States,US-NY-109,New York,Tompkins,Arnot Forest--Plots at Irish Hill and Morrell Rds,42.2930453,-76.6550678,Adult Male – 1,Song,Used,"","",,,Sound Devices Mix-Pre 3,Wildtronics Pro Mono Parabolic Microphone,"Wildtronics 22"" Parabola",,S69846238,"",,,"Response to playback from the Merlin app. Begins with very soft, simpler song. All songs in the first segment are at the same distance.",,Setophaga discolor,prawar,Species,32879,,3.50,2,"",,
239399211,Audio,Prairie Warbler,Setophaga discolor,,Wil Hershberger,2020-05-25,2020,5,25,500,United States,US-MD-043,Maryland,Washington,"Indian Springs WMA, two-track road",39.7194064,-77.9381753,Adult Male – 1,"Courtship, Display, or Copulation; Song",Used,"","",,,Sound Device 702,Senn. MKH8020,30” Roche Parabola,,S69608360,"",,,"Behavior and other notes: Adult male Prairie Warbler with a very odd song, he sounds like a Field Sparrow. The song is thin and lack the buzziness of a typical Prairie Warbler's song.  The first cut is natural, no playback was used and at 17 meters. The second cut, I used playback to bring him in for a better recording of this unusual song. He landed and sang from 3.5 meters. The songs were very low amplitude when he was close to me. Recording Time: 0713 (UTC -4).  Temperature 16C.  Habitat: Eastern Deciduous Forest, open fields, roadside. Distance to sound source: 3.5-17 meters.  Specific location: Indian Springs WMA, two-track road, Washington Co., MD. Latitude 39.719508, Longitude -77.937835.  Elevation 245 meters.  ID’d by sight and sound; ID confidence 100%.  Equipment notes: Recorder HPF on at 80Hz, -12dB/octave.",,Setophaga discolor,prawar,Species,32879,,3.00,1,"",,
239326501,Audio,Prairie Warbler,Setophaga discolor,,Seth Buddy,2020-05-28,2020,5,28,853,United States,US-NC-021,North Carolina,Buncombe,Sandy Mush Game Land--Bear Creek Access,35.7277016,-82.7044773,Adult Male – 1,Song,Not Used,"","",,,Tascam DR-100MKIII,Wildtronics Pro Mono,"Wildtronics 22"" parabola; windscreen",,S69753145,"",,,Third of three recordings of a male PRWA.  Bird was approx.5 meters up in an older group of white pine that stood out from the younger successional forest (also dominated by pine).  Recording ended when bird flew off.,,Setophaga discolor,prawar,Species,32879,,5.00,5,"",,
239326361,Audio,Prairie Warbler,Setophaga discolor,,Seth Buddy,2020-05-28,2020,5,28,853,United States,US-NC-021,North Carolina,Buncombe,Sandy Mush Game Land--Bear Creek Access,35.7277016,-82.7044773,Adult Male – 1,Song,Not Used,"","",,,Tascam DR-100MKIII,Wildtronics Pro Mono,"Wildtronics 22"" parabola; windscreen",,S69753145,"",,,Second of three recordings of a male PRWA.  Bird was approx.5 meters up in an older group of white pine that stood out from the younger successional forest (also dominated by pine). ,,Setophaga discolor,prawar,Species,32879,,5.00,3,"",,
239326111,Audio,Prairie Warbler,Setophaga discolor,,Seth Buddy,2020-05-28,2020,5,28,853,United States,US-NC-021,North Carolina,Buncombe,Sandy Mush Game Land--Bear Creek Access,35.7277016,-82.7044773,Adult Male – 1,Song,Not Used,"","",,,Tascam DR-100MKIII,Wildtronics Pro Mono,"Wildtronics 22"" parabola; windscreen",,S69753145,"",,,Second of three recordings of a male PRWA.  Bird was approx.5 meters up in an older group of white pine that stood out from the younger successional forest (also dominated by pine). ,,Setophaga discolor,prawar,Species,32879,,2.50,2,"",,
239092331,Audio,Prairie Warbler,Setophaga discolor,,Joel Tilley,2020-05-27,2020,5,27,723,United States,US-VT-021,Vermont,Rutland,"Hillside Road, Poultney, Vermont, US (43.527, -73.205)",43.5271353,-73.2047377,"",Song,Not Used,"","",,,Google Pixel phone,Comica CVM-VS08,,,S69718944,"",,,"Prairie Warbler rising, buzzy trill at 1.5, 9, and 19 seconds.",,Setophaga discolor,prawar,Species,32879,,1.50,2,"",,
239057061,Audio,Prairie Warbler,Setophaga discolor,"Passerina cyanea -- Indigo Bunting; Oporornis agilis -- Connecticut Warbler",Joanna Sblendorio,2020-05-27,2020,5,27,701,United States,US-MI-077,Michigan,Kalamazoo,Kleinstuck Preserve,42.2681633,-85.6025076,"",Song,Not Used,"","",,,,,,,S69709647,"",,,,Singing in canopy in same area as Connecticut warbler. Started near tall cypress tree and moved west towards huge fallen tree (right across from dirt path offshoot that leads into Connecticut warbler area). Sang in canopy until rain began again. Audio to follow shortly.,Setophaga discolor,prawar,Species,32879,,3.00,1,"",,
238917331,Audio,Prairie Warbler,Setophaga discolor,"Vireo griseus -- White-eyed Vireo; Corvus brachyrhynchos -- American Crow",Dean Newhouse,2020-05-26,2020,5,26,924,United States,US-PA-133,Pennsylvania,York,Apollo County Park,39.9099023,-76.3961848,"",Song,Unspecified,"","",,,Motorola Moto G6 Plus cellphone with RecForge II app.,,,,S69672009,"",,,,Probably many more than the dozen.  Stopped counting after a bit.,Setophaga discolor,prawar,Species,32879,,4.50,2,"",,
238579351,Audio,Prairie Warbler,Setophaga discolor,,Kevin Bennett,2020-05-25,2020,5,25,1118,United States,US-MD-033,Maryland,"Prince George's",Bowie State - Lake Loop Trail,39.0251674,-76.7540932,"",Song,Not Used,"","",,,Samsung S7,,,,S69620617,"",,,,,Setophaga discolor,prawar,Species,32879,,4.00,2,"",,
238488311,Audio,Prairie Warbler,Setophaga discolor,"Spiza americana -- Dickcissel; Sturnella magna -- Eastern Meadowlark",Chris Fagyal,2020-05-25,2020,5,25,628,United States,US-KS-091,Kansas,Johnson,"31801 West 135th Street, Olathe, Kansas, US (38.884, -94.955)",38.8840452,-94.9547568,Adult Male – 1,"Foraging or Eating; Song",Not Used,"","",,,Google Pixel 2 XL,None,NA,,S69607003,"",,,,Continuing.... Recorded call and great looks,Setophaga discolor,prawar,Species,32879,,4.50,2,"",,
238398881,Audio,Prairie Warbler,Setophaga discolor,Geothlypis trichas -- Common Yellowthroat,Justin Berkheimer,2020-05-03,2020,5,3,1013,United States,US-PA-049,Pennsylvania,Erie,Presque Isle SP--Pine Tree Trail,42.1705206,-80.0907129,Adult Male – 1,Song,Not Used,"","",,,Samsung S5,,,,S68346553,"",,,"In this recording, the Prairie Warbler is heard singing twice. I also captured a singing Common Yellowthroat and either a trilling Chipping Sparrow or Pine Warbler (I can't decide which). The recording was made by taking video with my smartphone in the direction of the singing. I extracted the audio and boosted the volume using Pazera Free Audio Extractor. In the program Audacity, I trimmed the audio to remove the sounds from my starting and ending the recording. Then I used the Amplify effect to reduce the volume of a couple of loud pops in the middle of the recording when I moved closer to the bird.","Lifer!! I entered Pine Tree Trail from the west side (lakeside) trailhead. Only a few steps in, I realized I was hearing a vaguely familiar bird song (something I've studied, but haven't experienced in person). So I followed the sound and quickly came to a small sandy clearing. I soon found an overall bright yellow warbler with cheeks outlined in bold black, similarly bold black streaks on its sides that faded down the flanks, dark wings, and an olive crown and nape. I quickly recognized it as an adult male Prairie Warbler! I couldn't see any red on his back, but I read that this is not unusual. I noted that he was pumping his tail. He was singing up a storm! He even sang two versions of the same song: both were rising in pitch, but one was slow and measured, the other was fast and accelerated. I recorded the latter.",Setophaga discolor,prawar,Species,32879,,3.00,1,"",,
238196191,Audio,Prairie Warbler,Setophaga discolor,Spiza americana -- Dickcissel,Chris Fagyal,2020-05-24,2020,5,24,834,United States,US-KS-091,Kansas,Johnson,"31771 West 135th Street, Olathe, Kansas, US (38.884, -94.954)",38.8840886,-94.9544184,"",Song,Not Used,"","",,,,,,,S69557165,"",,,,Continuing,Setophaga discolor,prawar,Species,32879,,3.50,2,"",,
237994201,Audio,Prairie Warbler,Setophaga discolor,,Luke Sievers,2020-05-23,2020,5,23,1000,United States,US-WI-133,Wisconsin,Waukesha,Ice Age Trail--Monches Segment,43.1903467,-88.3468580,"",Song,Unspecified,"","",,,,,,,S69540887,"",,,,"Bird was only seen briefly in tree top, unable to discern by color, was small and warbler-like. Bird was calling frequently. Able to identify with call.",Setophaga discolor,prawar,Species,32879,,3.00,1,"",,
237952671,Audio,Prairie Warbler,Setophaga discolor,"Spizella pusilla -- Field Sparrow; Poecile carolinensis -- Carolina Chickadee; Cardinalis cardinalis -- Northern Cardinal",joe demko,2020-05-23,2020,5,23,1126,United States,US-NJ-029,New Jersey,Ocean,"Manasquan River WMA (Ridge Rd Access, Ocean Co)",40.1255359,-74.1102934,Adult Male – 1,"Foraging or Eating; Song",Not Used,"","",,,iPhone XR ,Wildtronics Micro Mic PIP ,Wildtronics Pro Mini Parabola ,,S69524985,"",,,"Short song series; little background noise, with a few other species nearby; recorded with Voice Record Pro app",,Setophaga discolor,prawar,Species,32879,,2.00,3,"",,
237921131,Audio,Prairie Warbler,Setophaga discolor,,Joel Tilley,2020-05-23,2020,5,23,1259,United States,US-VT-021,Vermont,Rutland,Buckner Mem. Preserve/Bald Mtn. - Poultney River/East Bay IBA,43.5754609,-73.4089707,"",Song,Unspecified,"","",,,Google Pixel phone,Comica CVM-VS08,,,S69531685,"",,,,,Setophaga discolor,prawar,Species,32879,,1.50,2,"",,
237921121,Audio,Prairie Warbler,Setophaga discolor,,Joel Tilley,2020-05-23,2020,5,23,1259,United States,US-VT-021,Vermont,Rutland,Buckner Mem. Preserve/Bald Mtn. - Poultney River/East Bay IBA,43.5754609,-73.4089707,"",Song,Not Used,"","",,,Google Pixel phone,Comica CVM-VS08,,,S69531685,"",,,,,Setophaga discolor,prawar,Species,32879,,1.00,1,"",,
237921111,Audio,Prairie Warbler,Setophaga discolor,,Joel Tilley,2020-05-23,2020,5,23,1259,United States,US-VT-021,Vermont,Rutland,Buckner Mem. Preserve/Bald Mtn. - Poultney River/East Bay IBA,43.5754609,-73.4089707,"",Song,Unspecified,"","",,,Google Pixel phone,Comica CVM-VS08,,,S69531685,"",,,,,Setophaga discolor,prawar,Species,32879,,1.00,1,"",,
237852741,Audio,Prairie Warbler,Setophaga discolor,"Tyrannus tyrannus -- Eastern Kingbird; Spiza americana -- Dickcissel",Kathy Carroll,2020-05-23,2020,5,23,1223,United States,US-KS-091,Kansas,Johnson,"31610–31812 W 135th St, Olathe US-KS 38.88415, -94.95456",38.8841460,-94.9545630,Adult Male – 1,"Foraging or Eating; Song",Unspecified,"","",,,iphone 6s,iPhone 6s,,,S69521329,"",,,,Continuing rarity found by Jeff Witters. Yellow warbler with black streaked flanks. Black on face: line through eye connected to semicircle below eye. (Like letter D on its side.) Audio and photo.,Setophaga discolor,prawar,Species,32879,,3.50,2,"",,
237846631,Audio,Prairie Warbler,Setophaga discolor,,Jack and Shirley Foreman,2020-05-23,2020,5,23,606,United States,US-MO-071,Missouri,Franklin,Port Hudson Lake CA,38.4715139,-91.2681806,Unknown – 1,Song,Not Used,"","",,,Olmpus LS 10 ,Lav condenser Purple Panda,16 in parabola,,S69502326,"",,,Prairie Warbler,,Setophaga discolor,prawar,Species,32879,,4.50,2,"",,
237845531,Audio,Prairie Warbler,Setophaga discolor,,Larry Therrien,2020-05-23,2020,5,23,628,United States,US-MA-015,Massachusetts,Hampshire,Mount Holyoke Range State Park,42.3051456,-72.5279931,"",Song,Not Used,"","",,,iPhone SE,,,,S69500108,"",,,,One at top of mountain,Setophaga discolor,prawar,Species,32879,,3.00,1,"",,
237834891,Audio,Prairie Warbler,Setophaga discolor,,Roger Kroodsma,2020-05-23,2020,5,23,602,United States,US-TN-145,Tennessee,Roane,Lakeshore Park,35.9190666,-84.5023084,"",Song,Unspecified,"","",,,,,,,S69517290,"",,,,,Setophaga discolor,prawar,Species,32879,,3.00,1,"",,
237560551,Audio,Prairie Warbler,Setophaga discolor,Setophaga petechia -- Yellow Warbler,Ben Mirin,2020-05-19,2020,5,19,946,United States,US-NY-109,New York,Tompkins,Lindsay-Parsons Biodiversity Preserve (FLLT),42.3101677,-76.5216895,Adult Male – 1,"Foraging or Eating; Song",Used,"","",,,Zoom H6,Sennheiser ME62,Wildtronics Universal Parabola,,S69313828,"",,,"Bird seen 20 feet from microphone, on edge of woodland along the open field trail in Lindsay Parsons Biodiversity Preserve in Danby, NY. ",,Setophaga discolor,prawar,Species,32879,,5.00,2,"",,
237262851,Audio,Prairie Warbler,Setophaga discolor,Setophaga petechia -- Yellow Warbler,Susan Elliott,2020-05-20,2020,5,20,1404,United States,US-VT-021,Vermont,Rutland,"Money Hole Rd, Benson",43.6989462,-73.3460045,"",Song,Unspecified,"","",,,,,,,S69380268,"",,,,,Setophaga discolor,prawar,Species,32879,,3.00,1,"",,
237177601,Audio,Prairie Warbler,Setophaga discolor,"Pipilo erythrophthalmus -- Eastern Towhee; Cardinalis cardinalis -- Northern Cardinal; Icteria virens -- Yellow-breasted Chat; Passerina cyanea -- Indigo Bunting",Blaine Carnes,2020-05-20,2020,5,20,1035,United States,US-TX-315,Texas,Marion,Liberty Road,32.8491702,-94.4393671,Adult – 1,Song,Not Used,"","",,,Tascam DR-40,Audio-Technica AT875R,,,S69396038,"",,,,,Setophaga discolor,prawar,Species,32879,,4.00,2,"",,
236994611,Audio,Prairie Warbler,Setophaga discolor,"Pipilo erythrophthalmus -- Eastern Towhee; Poecile atricapillus -- Black-capped Chickadee; Spizella passerina -- Chipping Sparrow; Passerina cyanea -- Indigo Bunting; Seiurus aurocapilla -- Ovenbird",Christopher McPherson,2020-05-20,2020,5,20,800,United States,US-NH-011,New Hampshire,Hillsborough,"South Side of Groton Rd (111A) old sand pit, Nashua NH",42.7036321,-71.5216827,Adult Male – 1,Song,Not Used,"","",,,SOund Device Mixpre 3 II,Sennheiser MKH 20,Telinga Univ. MK II,,S69389730,"",,,,,Setophaga discolor,prawar,Species,32879,,3.50,2,"",,
236956291,Audio,Prairie Warbler,Setophaga discolor,"Pipilo erythrophthalmus -- Eastern Towhee; Icteria virens -- Yellow-breasted Chat; Cyanocitta cristata -- Blue Jay; Setophaga citrina -- Hooded Warbler; Passerina cyanea -- Indigo Bunting; Seiurus aurocapilla -- Ovenbird; Zenaida macroura -- Mourning Dove; Vireo griseus -- White-eyed Vireo",Laura Gooch,2015-06-05,2015,6,5,650,United States,US-OH-145,Ohio,Scioto,"Shawnee State Forest--Forest Rd. 6, Panoram Loop",38.7602075,-83.2351255,Unknown – 1,Song,Not Used,"","",,,Olympus LS11,Panasonic WM61A electret,24-inch stamped aluminum Edmund Scientific parabola,,S69383025,"",,,"Recording Time: 8:55:00 AM (UTC -4). Temperature: 19 C. Habitat: Clear Cut. Background species: Pipilo erythrophthalmus, Icteria virens, Cyanocitta cristata, Setophaga citrina, Passerina cyanea, Seiurus aurocapilla, Zenaida macroura, Vireo griseus. Specific Location: Latitude 38.77293217, Longitude -83.17987657, Elevation 344 m. Shawnee State Forest: Clear cut area north of Forest Road 6 west of the intersection with the Holley Hollow Bridle Trail. 13.1 km east (bearing 92.1) from Blue Creek, Ohio. ID'd by Sound; ID confidence 100%.",,Setophaga discolor,prawar,Species,32879,,4.50,2,"",,
236944131,Audio,Prairie Warbler,Setophaga discolor,"Zenaida macroura -- Mourning Dove; Hylocichla mustelina -- Wood Thrush; Icteria virens -- Yellow-breasted Chat; Vireo olivaceus -- Red-eyed Vireo; Corvus brachyrhynchos -- American Crow; Setophaga citrina -- Hooded Warbler; Pipilo erythrophthalmus -- Eastern Towhee; Setophaga americana -- Northern Parula",Laura Gooch,2015-06-05,2015,6,5,650,United States,US-OH-145,Ohio,Scioto,"Shawnee State Forest--Forest Rd. 6, Panoram Loop",38.7602075,-83.2351255,Unknown – 1,Song,Not Used,"","",,,Olympus LS11,Panasonic WM61A electret,24-inch stamped aluminum Edmund Scientific parabola,,S69383025,"",,,"Recording Times: 7:04:00, 7:09 AM (UTC -4). Temperature: 16 C. Habitat: Clear Cut. Background species: Zenaida macroura, Hylocichla mustelina, Icteria virens, Vireo olivaceus, Corvus brachyrhynchos, Setophaga citrina, Pipilo erythrophthalmus, Setophaga americana. Behavior and other notes: Singing on a steep slope in clear cut area. Clear cut has much 2-3 m tall brushy vegetation and isolated standing trees. Specific Location: Latitude 38.77361622, Longitude -83.17872003, Elevation 360 m. Shawnee State Forest: Bridle Trail from FR 6 to Bear Creek Lake Horse Camp. 13.2 km east (bearing 92.4) from Blue Creek, Ohio. ID'd by Sound; ID confidence 100%.",,Setophaga discolor,prawar,Species,32879,,3.50,2,"",,
236909211,Audio,Prairie Warbler,Setophaga discolor,Spizella pusilla -- Field Sparrow,Jim Emery,2020-05-15,2020,5,15,905,United States,US-VA-107,Virginia,Loudoun,"Reservoir Rd, Ashburn",39.0138290,-77.5619100,Adult – 1,Song,Not Used,"","",,,Tascam DR-05,,,,S69097545,"",,,,,Setophaga discolor,prawar,Species,32879,,3.50,2,"",,
236285591,Audio,Prairie Warbler,Setophaga discolor,,Dean Newhouse,2020-05-18,2020,5,18,755,United States,US-PA-133,Pennsylvania,York,Gifford Pinchot SP--Quaker Race Day Use Area,40.0735643,-76.8955421,"",Song,Unspecified,"","",,,Motorola Moto G6 Plus cellphone with RecForge II app.,,,,S69268990,"",,,,,Setophaga discolor,prawar,Species,32879,,3.00,1,"",,
235811801,Audio,Prairie Warbler,Setophaga discolor,,Julia Plummer,2020-05-15,2020,5,15,916,United States,US-PA-027,Pennsylvania,Centre,Scotia  Barrens (IBA)--general,40.7899360,-77.9511360,Adult Male – 1,Song,Not Used,"","",,,Zoom F1,SGH-6,,,S69080777,"",,,,,Setophaga discolor,prawar,Species,32879,,3.00,2,"",,
